Rating,Title,Content,Author Name,Date
10,The best of the series franchise!,"This was by far the best of the Fast & Furious series! It had a very good storyline, a great villain, and the action was non-stop from start to finish. Can't wait to add the Blu-Ray to my collection when it come out! The humor is just the right amount without overshadowing the plot. Somehow, they continue to seamlessly weave the story lines of all previous f&f's together so that it all comes together with a big aha! Dwayne Johnson and Vin Diesel (wow!) are both very good in their respective roles. There really is no supporting cast in this movie because everyone carries off their roles like lead actors. Kudos to the franchise for a great summer kickoff! Based on this latest release, I can't wait to see what's next!",chequitaj,"May 27, 2013"
8,Must Watch!,No content,sagarkumar_04,"May 27, 2013"
9,This series just keeps getting better,"This is one of those rare occasions when a franchise goes from being okay to being absolutely awesome. 12 years ago, I would have never expected this series to make it this far and not only that, to evolve into what it is today. Furious 6 does not pretend to be anything else but a high octane summer action movie and it does it better than any other movie this year so far.In Furious 6 agent Hobbs request the help of Dominic and his crew to find a dangerous mercenary in exchange for full pardon, but also to find Dominic's believed deceased girlfriend, Letty. This movie almost feels like a testosterone 007 movie. The series takes us to Spain and England. The chase sequences are just amazing, the stuns are great, and the cars, well; it's a Fast and Furious film. The acting it's what it is, but the thematic of family and friendship are believable and heartwarming. The main villain this time around is pretty solid and does feel like a true challenge for the protagonists. This movie was so well made and so fun to watch that after watching the surprise revelation at the ending credits I can't wait to see the next one. Furious 6 has it all, action, comedy, women, and a lot of insane cars. This is what true blockbuster movies are all about. I highly recommended.",nvillesanti,"May 27, 2013"
1,Seriously,"Why is this movie rated higher than Paul Thomas Andersen's The Master or Stanley Kubrick's Eyes Wide Shut. It isn't shocking to see a mindless movie like this gross a lot of money at the box office, since it is 12 year old's that frequent cinemas, but i can't understand why this movie has a 7.4 rating on IMDb where 12 year old's don't own accounts.I liked fast 5 because, so i went to the theater with my friends with bigger expectations and came out highly disappointed. the movie is full of plot holes to begin with. I usually forgive summer movies for this sin but it way to much here. It wasn't as half as funny as the first one. Some of the lines between Tyrese Gibson and Ludicrous, who isn't a good actor by the way, aren't amusing. What is worse is that some times other conversations are introduced just so as to bring in a line between these two. It must be the epitome of bad script writing. My 13 year old sister could write better lines. The action sequences are also ludicrous. I know this is a fast and furious movie but the guys here do some stuff here that Spider-Man only dreams of. What is even more insulting is that the critiques aren't all that hard on this movie. I don't know why some summer movies are admonished for minor misdemeanors but this one gets a pass. One critique wrote that the fast and furious movies are getting so good that by the time they get to fast 16 it would be up for best picture. Do you value time and money? Do you have an IQ above 70? Are you older that 12? If your answer is no, then you are in for a treat.",christian-tesfaye,"Jul 24, 2013"
8,Keeps on keeping on,No content,Robert_duder,"Apr 27, 2019"
8,Check Your Brain at the Door,No content,eti55,"Jun 17, 2013"
8,Surprisingly enjoyable,"Fast and Furious 6 is surprisingly enjoyable, especially for a sixth movie in a franchise. It had lots of good drama and action, I'm really looking forward to the next one.",reesev-02804,"Aug 1, 2022"
5,"throughly enjoyable, but who the hell wrote the script",No content,Jqn_Hgar,"Aug 19, 2013"
8,Enjoyable and spectacular instalment! 8.,"I must say this is a saga I like. I liked the first installment, hated the two and third movies (awful) and was positively surprised by the next three, in fact, these are the best, specially the sixth. It is not an epic saga, like ""Star wars"", ""Indiana Jones"", ""Mission: impossible"" and ""007"", but it is very enjoyable and worth watching for the action fans like me. Justin Lin managed to revitalize the saga with the fourth part of it after those two piece of rubbish. In fact, the six one fixed in some way the third one (I should say it gives some sense to the third movie at the end). He really knows how to deal with action. It is true the action scenes are inverosimile, but they agree with the movie's tone. The car chases, gunshots and body fights are spectacular and one of the main attraction in the movie. The pace is another strong point. It never made me bored in spite of its more-than-two-hour-duration and poor performances. It begins by introducing the characters and their situation and then, the action begins with many explosions, chases, shots, twists, etc. The sceneography is very nice, the best in the saga: the Canary Islands, London and L.A. The soundtrack is very good and proper, too (listen to the song ""We own it""). The cast is attractive: Vin Diesel, Paul Walker, The Rock, Elsa Pataky, Ludicrous, Gina Carano, Luke Evans, Jason Statham... Except the last two, these are not very good as actors, but are very appropriate for this kind of movies and deliver fun (not deep and dramatic) performance. This is not about character development at all, however it is true there is an evolution in the main character's lifes, which is good indeed. Vin Diesel is one of the least expressive actors in Hollywood's history (The Rock acts better even though he is not a real actor but a wrestling factor, unlike Vin). Paul Walker is dull and they should dress him better to take advantage of his beauty. Fortunately, Elsa's character is unimportant and the script contains many jokes. Anyway, in this aspect, this is the best movie in the saga because the cast contains both Jason Statham and Luke Evans. They are evil characters. The first only appears for a few seconds but very intensely. Luke Evans as the main villain plays a very believable and tough role which represents an added value for the movie. In conclusion, the worst in the movie are its lack of originality, rather flat characters and dull performances from many actors. The best thing is that it gives sense to the threequel, the pace, the capacity of entertaining, the cast, the action scenes (specially the first car chase in London), the sceneography (London is the city I visited I like the most), the main villain, Statham's cameo and the cars. I recommend it to the fans of this saga. 8.",manusanchez90,"May 30, 2013"
10,This is a review on Fast and Furious 6,No content,bigsean863,"Jun 18, 2013"
1,"blah blah boom stunts...fine, but how in the world did this script make it to screens?",No content,mttafesse,"Aug 11, 2013"
8,Summer Popcorn Movie,No content,stevendbeard,"May 24, 2013"
8,Fast 6,"I'll admit I was always a fan of the Fast and Furious series, but I wasn't a true lover of the series until it was revamped in 2009 with Fast & Furious; from there the series took off and became bigger and better.With that, Fast Six was a great flick don't get me wrong, the action, the story, and the cars were great, but I feel the movie was slightly too long and dragged out. I feel if they stuck to the pace of Fast Five, the film would have been perfectThe Pros: The cars were great! The actors sexy and believable and the action bigger and better than the predecessors.The sets amazing! had this been a straight racing movie, I feel the film would have fallen flat and not been as great.The Cons: The story had potential, it made sense and was definitely obtainable, having said that the story had too much going on that made the film jump around and wasn't cohesive. The action while amazing, was insane and probably would never happen in a real life setting (still was amazing to watch).Regardless of the cons that didn't float my boat, I still loved the movie and it was a pleasure to watch, i'm super stoked for Fast 7, if you want a taste of Fast 7 go watch Fast 6, enjoy a great car action movie and have a good time.",nflores342,"Jun 1, 2013"
10,One of Best action films of the year,"Fast And the furious 6 : Great Movie Non stop action follows the story line of the rest perfectly the same cast as all the others returns again for the 6th installment of the series and it Doesn't miss a beat Non stop action through the whole film, picks up right were it left off and sticks to the same action packed turbo boosted set up as before you get the story as to what happened to letty in the last one, it's got faster cars more off the wall jet fueled racing and even more non stop action this is a must see film if you liked the rest you will love this one it doesn't disappoint i give this a full 10 stars across the board,The new fast and furious the 6th one awesome movie just as good as the rest if not better Loved it, definitely a series that still got it",Stoneybudzz,"Jul 10, 2013"
1,"Insulting to one's intelligence, CGI action lame!",No content,samkaysam,"Aug 19, 2013"
8,A blast!,"This movie was a blast! It was an action packed, humor thrilled action film with cool stunts and fights. The way the characters are laid out and used in the film is how Joss Whedon would use his character in a TV series he would make. My Example being Firefly. This is a prequel to a few of the previous films, though I will admit I lost track of the order. However plot and characters and all of those tie ins with the other movies wasn't too much of a concern since I went into this movie to watch an action packed thrill ride that would take some time out of my night, and then help me sleep and dream about fast cars and beautiful women. It's not as good as Fast Five 5, but its just as entertaining.",jayore3,"May 25, 2013"
8,Action Packed,"Lots of action here from start to finish. The story plot I thought was better in fast 5 but Fast 6 doesn't disappoint with it's ambitious action scenes. Undoubtedly the scene that got the biggest pop from the crowd was the second ending. The ending after the credits but thats saying a lot considering we saw a full slobber-knocker scene with Michelle Rodriguez and the MMA chick, a ambitious air plane scene, and insane highway-bridge sequence. Oh yeah...we still got to see some cars and some hot girls with daisy dukes on.THis franchise definitely got better as time went on...a welcome change since usually most movie franchises go down the drain.",jfm358-88-873130,"Jun 8, 2013"
10,Awesome with a charismatic sense of humor!,"Never have I seen an action-adventure film with a little bit of some comedy here and there. This film was just perfect in that sense. The cast was remarkable and pretty amazing, especially Dwayne Johnson, otherwise known as ""The Rock."" Dwayne Johnson is a pretty decent actor in general, so I'm not surprised to hear that this film is one of his best works. Keep it up, Dwayne! You've kept me enthralled all throughout this film.I know everyone has a different preference of movies that they like, but I don't understand who in the world would ever hate on such a perfect movie like this. Sure, not every movie that comes out these days are the best, but I think people need to learn to stop judging a movie if they've seen it for ten or twenty minutes and then proclaim it to be ""awful."" That's just stupid; you have to actually watch the entire film first to know whether if you like it or not. Believe me, I went to the movie theater and watched this film from the very beginning to the very end. It has some hilariously stupid lines, which is what makes it funny, something that will keep you captivated from all the action and adventure going on in it. Just watch this film, people. For all the males out there, I'm pretty sure you'll find Jordana Brewster and Michelle Rodriguez to be ""hot."" ;)",sadewolu,"Jan 2, 2014"
5,Disappointing,No content,rai-shreyas,"May 24, 2013"
9,All around great film!,"I think this one is the best in the series! It has action fast cars and great stunts. The franchise is just going to get better and better. I would make one change and that is to return to its roots, Drag racing and a bit less circuit racing. Don't get me wrong I love the movie but Drag racing is just so much more exciting. I was really pleased with the return of Michelle Rodríguez, I love her character. The car selection is great from the Nissan Skyline to the '74 Ford Escort RS2000. The casting is great all my favourite actors and actresses are back and looking good. The fight scenes where very well choreographed and very entertaining. And the way the audience is told about Letty was very well planned out and brilliantly executed.",stefantheron3,"May 27, 2013"
8,A franchise that has over-corrected enough to finally get back on track,"Fast & Furious 6 picks up on our trusted gang of gearhead criminals following the heist they pulled off in Rio de Janeiro that took place in Fast Five. Now, all of Dom Toretto's (Vin Diesel) crew are fugitives, including the retired FBI agent Brian O'Conner (Paul Walker) and his wife Mia (Jordana Brewster), Dom's sister with whom he now has a child. The family are now living in Rio de Janeiro off of the $100 million sum of cash they stole and are trying to maintain normalcy into adulthood. One day, the U.S. Diplomatic Security Service agent Luke Hobbs (Dwayne ""The Rock"" Johnson), who previously tried to stop Dom and his gang's efforts to pull off the heist, has discovered potentially revolutionary information on Dom's allegedly deceased girlfriend Letty (Michelle Rodriguez), who was seen alive and taken by a vicious British Special Forces officer named Owen Shaw (Luke Evans).The bottom line is Shaw needs to be taken down and Hobbs knows that Dom, Brian, and Mia, despite being a family, have the skill-set and power to take down Shaw. Hobbs agrees to allow them entry into the United States once again on a citizen status rather than fugitive one, to which they accept. Reassembling their team of Roman (Tyrese Gibson), Han (Sang Kung), and Tej (Ludicrous), the gang looks to take down yet another criminal mastermind no international organization in the world can touch and only a group of skilled racers can infiltrate.Fast Five was a film that bothered me in numerous respects, but mostly because it seemed that it did nothing more than sell out the core principles of what its franchise was founded upon in order to pull in a greater audience. The sad part was, through all the physics-defying flashiness and stunt chases, even the core fanbase of the series fell for its tricks, and the film went on to be declared the best in the franchise by many critics and audiences. Having said all that, going into Fast & Furious 6 knowing that this new gritty, crime-drama style the series has been implementing since Fast & Furious, the fourth installment, was still going to be in effect, I was about as hesitant as ever.I emerge from the film with the confidence in saying that Fast & Furious 6 is the best film in the series since 2 Fast 2 Furious, a film that for all its issues, is still a fine piece of action-comedy during a year where that genre thrived (the underrated Hollywood Homicide, for one, also came out that same year). This is a film that has it both ways: it's a slick and stylish film predicated upon car racing and vehicular muscle and a strong crime-drama that keeps its characters in perspective through all its gritty style.Fast & Furious 6 touches more on pathos than the previous installments; it cuts through the blatant homoerotic relation the male characters have with other male characters and the fetishization of their vehicles to reveal a deep humanity in regards to relationships. Consider when Dom finds out the high possibility his girlfriend he believed to be deceased is now still alive and, despite being incredulously so, she doesn't remember him at all upon seeing him again. These scenes are revealing because, for once, behind all the glitz and glamour of this franchise, these characters, in addition to the audience, can step back and see the individuals behind the wheel as people (the humans crushed in the scene that takes place on a highway, involving a tank going the wrong way and demolishing every car in its path don't get the same luxury of being humanized, but an installment in this series has yet to be perfect). The emotions don't run saccharine-thick, but they are present, and unless you've let the macho physiques of Diesel and Johnson get the best of you throughout the course of this film and the last, you should at least be able to respect the film's intentions and see what it's doing.Then there's the fact that this film, unlike the last three before it, is plain fun. The characters are more unified in this film, working together and asserting their own personalities rather than just ostensibly working off of one another in a contrived manner in Fast Five. The conversational banter between characters here is also, for the first time since 2 Fast 2 Furious, strong in a way that's witty and enjoyable, though not overdone like in the aforementioned film. Finally, the film's slickness and gritty story doesn't become a downbeat array of fistfights and shootouts like in Fast Five. Everything feels, even for a Hollywood action film, delicately handled and even modeled in a way that emphasized slowburn pacing with humans at the core.Fast & Furious 6 still finds itself overwrought in terms of further distancing itself from the downhome realism in the first film to the point where its inclusion is about as minuscule as a spec of dust on one's rearview mirror. Having said that, when it comes to The Fast and the Furious franchise rebranding itself, this is a more assured and capable spectacle that doesn't feel like it's pandering or selling out, but truly embracing the souls many of us have followed for over twelve years now. Director Justin Lin and screenwriter Chris Morgan, who have handled the directing and writing jobs, respectively, for every installment in the franchise since Tokyo Drift, have finally come to the point where they're not only respecting those involved in the projects, but also the audience.Starring: Paul Walker, Vin Diesel, Michelle Rodriguez, Jordana Brewster, Dwayne ""The Rock"" Johnson, Tyrese Gibson, Ludicrous, Sang Kung, and Luke Evans. Directed by: Justin Lin.",StevePulaski,"Dec 17, 2015"
8,Michelle Rodriguez and Gina Carano worth the price of admission,No content,JohnRayPeterson,"Jun 11, 2013"
4,Most Ridiculous Film I've Seen All Year,No content,Cinobite17,"Nov 16, 2013"
9,Its Fast and Furious 006...but its 007 they're aiming for!,No content,s_campanale,"May 17, 2013"
8,My First F&F Film and I Liked It!,"I have not seen a single installment of the ""Fast and Furious"" franchise, one of only a few, I am sure. I never got around to watching the first one at all, consequently I never did get to watch the second, nor any of the five. There was very big buzz about the last one ""Fast Five,"" but unfortunately I was not able to catch it. Now, this time, since Vin Diesel and Michelle Rodriguez made the effort to come over to our country and grace this film's Premiere here last week (the first Hollywood premiere in Manila). I made it a point to watch ""F&F 6"", and I'm glad I did.Now I see what the fuss was all about, and why this franchise has lasted this long and still goes strong. The car chase scenes, on which this franchise's fame lay, were amazingly planned, executed, shot and edited. There was that chase scene on the freeway with a tank, ending with a superhuman midair rescue you simply have got to see. As if that is not enough, the entire last sequence was about cars trying to get a Russian cargo plane from taking off, all the while fighting off the enemies mostly mano a mano. I commend director Justin Lin for these ace pieces of action direction.In between these big action sequences, there are the scenes of the team led by Dom (Vin Diesel) and Brian (Paul Walker) talk about about being a family and never leaving anybody out. Among the members of the gang, Tyrese Gibson stood out as the loquacious Roman, the film's main source of comic relief. His funny one-liners also came fast and furiously hilarious. Matching big and beefy Vin Diesel is big and beefy Dwayne Johnson. The Rock plays a cop, Agent Hobbs, who sought help from Dom's and his team in apprehending another team of mercenary drivers doing terrorist errands led by Owen Shaw (played by Luke Evans). In return for their help, they asked Hobbs to work for their amnesty so they can all go back to the States, instead of hiding in countries without extradition as they are now. The unexpected return of Letty (Michelle Rodriguez), who was apparently thought to have been killed in a previous episode but now was working with the enemy, provides dramatic focus for the characters, particularly Dom. Overall this is one very entertaining and exhilarating film, which I understood and appreciated well even if I have not seen any of the previous films. Well, I am sure fans who have seen all the movies will love it even more than I did since they have known and loved all these characters already. The top-notch action sequences left nothing to be desired, really breath-taking. These heart-stopping stunts are all admittedly downright ridiculous and impossible, but that was why they were all so awesome to watch.",3xHCCH,"May 24, 2013"
8,Has good as Fast Five,"Agent Hobbs(Dwayne Johnson) is hot on the trail of a gang of ruthless hijackers led by Shaw(Luke Evans) in London, and this gang is too clever, they always manage to stay two steps ahead of the law. So Hobbs figures you need criminals to catch criminals. So Hobbs ask for Toretto(Vin Diesel) and gang for help, and promises them full pardons if they succeed.The action is incredible, so where the characters, everybody plays off themselves perfectly. Luke Evans is calm, cool, villain. Dwayne Johnson really owns things up in all most every scene he's in. Vin Diesel is entertaining has Toretto. But it's Tyrese Gibson who steals the show has the nitwit of the group. It does have good fight scenes, and the car chase scenes are pretty intense.",DarkVulcan29,"May 27, 2013"
1,Too much incredulous stupidity for me to handle,"I can handle a certain amount of incredulous stupidity in film, if it entertains. But when a movie like FF6 blatantly abuses that limit of incredulous stupidity, I tune out.I only paid to see FF1 and FF2 in theaters. After that, I have only watched the rest of these ridiculous sequels for free on cable TV. I figured that I can handle the stupidity if it is free and it entertains.But the entire time you watch this movie, you will not be entertained. You will be constantly asking yourself ""do the people who make this movie think I'm THAT stupid??""There are ""turn off your brain movies"", and then there's this overblown turd which amplifies the stupidity x100. I won't bother giving a plot review because there is no plot. I won't bother commenting on the acting, because there is none.All I'm saying is this.... If you're going to make a movie to entertain me, don't insult my intelligence this blatantly.",artgutierrez,"Nov 15, 2017"
8,Great Movie,No content,projectsgamer,"Jun 25, 2021"
8,Next to Last Walker F&F Show,No content,shelbythuylinh,"Dec 13, 2021"
8,Very good,"Fast & Furious 6 is fast-paced and packed with adrenaline, the movie uses everything in hype, gunfire, fights, car chases and explosions! For me it surpassed the previous movie which I criticized a lot and so my movie rating is 8.0.Movie seen on April 5, 2019",mfellipecampos,"Nov 21, 2019"
2,Just plain silly,No content,dreaded-eddie,"Jul 7, 2013"
