Rating,Title,Content,Author Name,Date
6,"It is what it is - 5,9/10","Fast & Furious 6, what can I say? I mean, my expectations were really low and boy were they met. I'm not saying the type of low like ""This is going to be bad"", more like ""Hmm, I might give this a shot"". The director Justin Lin doesn't try to do anything else other than sticking to the trashy film that it is, and I would give him and the movie credit for that. But more? Nope, I think people are giving it too much credit for that. Sure, there were some ""good"" trashy action set-pieces in there, some muscle(cars), a tank, big guns, and... Nothing more. Maybe Vin Diesel flying across a very big gap between two bridges to save Letty (Michelle Rodriguez) and landing on a car breaking the laws of physics - why? Because ""She is family, and family stick together, you don't turn your back on them even if they do"", or something. One thing maybe worth mentioning are the physical performances by everyone in the movie, especially the ladies.Everything ""good"" that was in the movie was already in the trailer, so what I ended up doing was just waiting for the scenes to pass by. There was a sequence in it where they had to drive after an airplane, and then they actually brought it down with some hooks and whatnot. That sequence goes on for about 15 minutes, which means that the runway must've been very, very long. And of course after that sequence they get to the end of the runway. A lot of innocent people also died in the scene with the tank (where it just runs over random cars with unimportant people in them).A lot of people did laugh, and they laughed a lot. The only thing that made me chuckle was probably The Rock himself just him being there. The only time I actually laughed was when the title ""Furious 6"" (If you have seen the movie you'll know which one I mean) came up because some guy in the back shouted ""6 Furious"". And I am not joking when I tell you that it was the only time during the movie that I actually laughed.This movie left me very uninterested and bored because of the plot, story, badly written characters and the dumb dialogues. I couldn't enjoy the big action set-pieces because I was so bored. So in general, this is a boring movie in every kind of way. And the fact that people in the audience gave a it big round of applause after the movie ended just made me wanna stick my head in the sand.",yaldish,"May 24, 2013"
No rating,Faster Than the rest of the franchise !!!,"This movie was so great maybe the best between the franchise the energy creativity in this movie was not found in the others i enjoyed every single second in the movie,beside for a movie who has explosive and fast cars with fight scenes it had a decent plotbut i won't say anything cause there is some TWIST in the plot i laughed so hard in this movie i would say almost half of the movie was comedynow for the post ending after credits it will grin your ears and make you curious about fast 7 the film deals with criminals world class with great mayhem by their carsIf you are interested by cars and explosive things and comedy with an amount of drama and love plus fight scenes with awesome mayhem F&F 6 is what you are looking forP.S:sorry for my English it's my second language",Tripmoh,"Jul 8, 2013"
6,"Same old, same old",No content,lewisboreham,"May 28, 2013"
9,Fantastic movie from an almost died-out franchise,"We've all seen our favorite movies churn out those forgettable and often straight-to-video sequels; Death Race, Wrong Turn, Resident Evil. (Really, not Resident Evil???). And with The Fast and the Furious series, you were starting to see the decline after 2 and most definitely 3. So for Justin Lin to bring back this series from the dead, even to use the weird sequels as a part of the story in his new trilogy, is incredibly impressive.As for Furious Six, I thought it was incredibly enjoyable. Few movies are actually this fun to watch. The action felt very well paced, never dragging on or repetitious in any way. The dialogue was humorous and the story was very interesting to see played out.I feel like the only movie I could compare this to is Transformers 3. Coming from a series that I felt like was convoluted and ""missing the point"" of a fun action film, Transformers 3 and Furious Six alike really meet what they were striving for. An incredibly fun film.This next part is mainly for people who have seen the movie already, though not a spoiler.I've seen a few reviews that say that last action packed scene in the film's climax was too much and could have been cut. I could not disagree more. I feel like the filmmaker mislead everyone to think everything was fine and dandy, all wrapped up, but I could not help but feel that the action was over too abruptly, and I still needed to see more. And then there is that last, incredibly epic action scene. The filmmakers made me feel like I needed to see more, so that they could deliver that last scene specifically for me. Great filmmaking, great film. Very impressed.",Ginnysababe,"Jun 9, 2013"
7,Lots of action but too much punching and kicking,This is a grand and extravagant looking production. The exotic locations are good. The car vs car action is what you'd expect and doesn't disappoint. Things go even further with tanks and planes. The car race in London was a bit artificially sped up. Who knew tanks could drive so fast. The attempts at humor are weak and mostly unfunny. But who care if some things are unreal thats part of the charm.Sadly the cast has aged. Paul is looking older = needs to stay out of the sun. Vin looks a little flabby. The Rock looked a bit too pumped up. Doesn't he know steroids are out now. The long drawn out obsession with Michelle Rodriguez's character is a bit tiresome. Jordanna is looking a bit gaunt. Luke Evans as the villain is a bit forgettable.Can there be too much action in a movie like this? In a way yes. The punching and fighting has come to equal the vehicular action. Enough of the fighting and punching back and forth! I know they had to use Gina Carano's skills but it felt like overkill. You can see that in any other action movie. Felt like a Hong Kong action flick.Overall things are quite grand and large scale especially looking back to the earlier ones in the series. Worth a watch.,phd_travel,"May 30, 2013"
10,Fast & Furious 6,No content,koolerkid1357,"Jul 15, 2013"
7,"It did not let the franchise down, Fun, action, speed...",No content,emeraldorc,"Jun 9, 2013"
10,Brilliant,No content,drewconnor,"Dec 4, 2013"
7,Every sequel has been a little better than the last!,"'FAST & FURIOUS 6': Three and a Half Stars (Out of Five) The sixth installment in the ever-popular action movie franchise brings back all the stars from the previous films including Vin Diesel, Dwayne Johnson, Paul Walker, Tyrese Gibson, Ludicrous, Sung Kang, Jordana Brewster, Gal Gadot and even Michelle Rodriguez (who's character was killed off two films ago). MMA champion (and rising female action star) Gina Carano (of 'HAYWIRE' fame) and Luke Evans also join the cast this time around. Justin Lin (who directed the last three sequels as well) returns as director and Chris Morgan (who wrote the last three installments) returns as the film's writer. This chapter has DSS agent Luke Hobbs tracking down Dominic Toretto and his team to enlist the gang's help in bringing down a team of deadly mercenary drivers. Toretto reluctantly agrees to help Hobbs when he discovers his old love, he thought was dead, is still alive and working with the team of mercenaries. The film is of course bigger and more action packed than ever and delivers everything die-hard fans of the series have come to expect.The movie begins with Dom (Diesel), Brian (Walker) and the rest of the car racing crew living around the world, on the lam, while spending the $100 million loot they scored in their Rio heist (at the end of the last film). Hobbs (Johnson), now working with his new partner Riley (Carano), tracks down Dom and convinces him to help him capture a team of mercenary drivers led by an ex-British Special Forces soldier named Owen Shaw (Evans). Hobbs offers Dom and his team full pardons if they help him stop Shaw but it's the info that Dom's ex-love Letty (Rodriguez) is still alive that persuades him into doing the job. Action and carnage ensue.I was never a huge fan of the original 2001 hit but I've liked each sequel a little more ever since (although I still haven't seen 'TOKYO DRIFT'). I think the franchise got a lot better with the last chapter when it added 'The Rock' into the mix. That's when box office for the series really skyrocketed and it also reached it's critical acclaim peak; how many movie series can one say that about (I can't think of any). It's great that this film added Carano as well and they also add another big action star at the end, in a post-credits scene, that should build even more anticipation for the next film in the series (which is already planned for next year). The franchise is still just a series of brainless action scenes strung together with no real plot or involving character development but they do keep getting more and more spectacular. This film does have some amazing car chases once again (including one involving a tank) but it still couldn't top the best car chase of the year (or just about any year) from another long running action movie franchise: 'A GOOD DAY TO DIE HARD'.Watch our movie review show 'MOVIE TALK' at: http://www.youtube.com/watch?v=Ge23zs5RPrM",Hellmant,"May 29, 2013"
1,7 out of 10?! What is wrong with you people?,No content,kozansahin,"Sep 18, 2013"
No rating,vertigo thrilling stronger sequel,"pretty good movie that would force you to sit straight and upright through the whole nine yards when it played on. yes, rarely a title possessed franchise could be this good, there were TV episode-like movies like 007 or mission impossible, but some of them just felt weak, either affected by weak screenplays, bad directors or newly replaced main characters, but fast and furious seems to not only be able to maintain the quality of each one, it is actually getting better and better. the last Brazilian heist was a rarely accomplishment with bolder and crazier scenario but turned out to be very thrilling. if you think dragging and pulling a huge bank vault around citywide in a firefight is crazy, watch this new one, tank, cargo plan, fast cars....you might need to take some tranquilizers to calm down your nerves and resettle your blood pressure after you back home from the theater. and again, you'll see some highly unlikely scenes in this movie like any other fast and furious movies: after digged a Russian made high power military standard bullet out of his right front should-chest area, the guy never needed to recuperated and didn't need any blood infusion, just wrapped up and beating his opponents like nothing happened. an at least over several tons super tank could drive as fast as all the fast cars and crashed them like eggs. the high speed of the tank on the freeway was some scene that i simply could not believe at all. then the firefight on the runway inside a cargo plane. well, since it carried out so over-the-top crazy, i have nothing to say no more. this is indeed a crazy movie but nobody won't dislike it.",rightwingisevil,"May 19, 2013"
7,car stunts,"Vin diesel and paul walker are a really good duo for the Movie series, and dwayne johnson is really cool working with vin diesel.Insane car stunts and Fight scenes, this is a Fun action movie.",MB-reviewer185,"May 2, 2021"
7,Insane physic-defying motor vehicle action spectacular,No content,swilliky,"Apr 16, 2017"
6,Auto fans will be disappointed,No content,rothj06,"Jun 2, 2013"
10,Outstanding Awesome film FUN,"This must be my favorite movie of all times. Having seen it for the first time this past weekend I was captivated by this brilliant piece of work. In the years ahead,I probably will see it a ""million"" times,owning it on DVD and future formats.Why is it so great? This is a movie that keeps you locked to the screen,because it has everything a great movie should have. A great story,a good length,tension,it is Vin Disel movie and the actors give top performances. Not just the Rock,although his performance is brilliant,but everyone else.I will not repeat the story here,but I can tell you,this film will capture you,all the characters are portrayed brilliantly by the actors. There is excitement,humor,tension,drama and emotion. See it,you will not regret it!",Vin_Diesel_Forever,"May 28, 2013"
7,Not Really Fast or Furious,"Still trying to get through all the films in this franchise (I still have two yet to see since I've watched them out of order and started with parts 8&9 first) and they still do absolutely nothing for me. ""The Family"" has gotten increasing big (but at least they get rid of a few characters for this film) and the themes haven't changed (which makes it all a bit dull and predictable) and the best thing about this film is Tyrese and Ludicrous (whom seem to get all the best lines). As much as I love Luke Evens, he's wasted in this film as is The Rock (who is in true supporting character mode). I wasn't impressed with any of the action sequences (except for maybe the tank sequence as that was the most entertaining sequence in the entire film). I can't even say that through all the blandness that the cast was pumped and energize as most of them seemed to be phoning it in. I haven't seen Furious 7 yet...I'm not excited in the least and surprised this franchise has lasted as long as it has.",nqmedia,"Feb 9, 2025"
10,Portion of 'Fast & Furious 6' DVD sales to benefit Paul Walker's charity,"Following the tragic death of actor Paul Walker this weekend, Universal Pictures announced Tuesday that a portion of the sales from the DVD, Blu-Ray and digital releases of Fast & Furious 6 will go to Walker's charity Reach Out Worldwide. ""With the passing of Paul, the world has lost a man who spent a great deal of his life in service to others. We share in the deep grief of his family, friends and the countless fans who love him,"" said Donna Langley, Chairman of Universal Pictures. ""We keep Paul's memory alive and honor his legacy through continued support of Reach Out WorldWide, the non-profit he founded to give hope to those who must rebuild after they have experienced natural disasters.""Walker started ROWW after returning from a trip to Haiti in January 2010, when the country was devastated by massive earthquakes. The organization is a network of professionals with first responder skill- sets who augment local expertise when natural disasters strike in order to accelerate relief efforts. Fast & Furious 6 will be available on Blu-ray, DVD, digital and VOD on Dec. 10. Those wishing to express condolences to the Walker family are also encourage to make a donation to ROWW through their web site.",dapne2,"Dec 3, 2013"
7,The Best Fast & Furious Yet!,"Never have been a fan of this series, but after seeing the trailers and hearing some positive things, I decided to give this one a shot. And ya know what? I actually had a pretty fun time. I like the direction Justin Lin took with this one just making it big and stupid, but totally self-aware of what it is. The action set-pieces are an absolute blast to watch with each one topping the previous one before it. The last 2 scenes are worth the price of admission alone. I also enjoyed the chemistry between all the actors which added a surprising amount of laughs to the film. Still, the film has plenty of flaws that the series has shared. There is a bit too much down time in the middle where the film starts to drag when it begins to build on it's incredibly thin story. There's also some moments of dialogue that are so poorly written it's hard not to notice them. Overall, while it's not great by any means, I would defiantly say that this is my favorite of the series so far (although that's not saying much). Nothing special or all that memorable, but as a summer popcorn flick, it gets the job done. Fans of the series will most likely love it while even the non-fans will still be able to have some fun with it. I do have to admit though after the post-credit scene, I would be lying if I said I wasn't incredibly excited for the 7th installment!",Rebel_With_A_Cause_94,"Jun 1, 2013"
8,woo!!!!! fast,"A typical fast and furious movie loaded with machine guns,cars,muscular men,chicks,..etc...so far this is the best fast and furious movie,..very fast,enjoyable with terrific and exhaustible action sequences,..fast and furious fans should watch it,..and i recommend for others too,..actually highly recommended... it promises u for the 7th part in the end which ends up in Tokyo,,.. the next thing i wont tell,..because i don't want to spoil u'r movie. The movie keeps u entertained with a very fast moving plot,...jay z and ludicrous's songs,.. FURIOUS 6 is a pure action adrenal type movie,..and a must watch,..GO FOR IT...don't miss this one",bhatia_shaurya,"May 24, 2013"
7,Family,"Still, he's fast and furious, against the laws of physics. However, this is in the nature of the Fast and Furious series 🙂",jack_o_hasanov_imdb,"Aug 7, 2021"
1,Did a monkey get access to a typewriter again?,No content,mwburrows,"Jun 17, 2013"
No rating,Tetris is more realistic than this movie,"I wanted to watch this movie just for fun and had very little expectations in terms of realism. But even those vastly lowered expectations were not met. It was just not acceptable.I could have easily ignored the characters being walking clichés, the fact that violence is presented as the only appropriate solution to problems and the cheesy dialog. I expected nothing better. As long as story at least made some sort of sense. But it doesn't. There is no common sense in this movie. I cannot express enough how unrealistic this thing is. I didn't even expect that the story would matter to me, but at some point the stupidity of this movie was just becoming too much.If you want to watch this movie, don't think about what happens for one second, just enjoy the action scenes, which are great.",Arne_F,"Feb 20, 2015"
7,SOLID,"Nothing short of packed action stunts and emotional leverage, this film doesn't let us down. It may have a cliché storyline, but I think that's what makes the franchise so great.",jeromesgabilo,"Jan 31, 2022"
7,"High octane, nonsensical, OTT, explosive fun",No content,Rickting,"Nov 8, 2014"
6,Fast & Furious 6,No content,phubbs,"Sep 28, 2013"
10,Tyler Posey and Colton Haynes In Fast and Furious 6 2013 In Yes,"Tyler Posey and Colton Haynes Fast and Furious 6 2013 as Tony Torreto & Kenneth Hicks 11/10 Liked Rating 12.9/10 Most Underrated very underrated really underrated Ecstatic Strong High & Critically Rating Ten Out Of Ten Eleven. Nine out of Ten +100+400+% +100.9+400.9+% Tyler Posey (From Legendary and Teen Wolf) Colton Haynes (From CSI: Miami and Teen Wolf) Yes, Fast & Furious 6 Has Appeared In Fast & Furious 6 Strongly agree extreme like extremely likely Most underrating very underrating really underrating +1000 out of 10 +1000.9 out of 10 1000 out of 10 1000.9 out of 10 very good really good super rating 10/10.",ishabaigirfan-61351,"Jan 27, 2025"
7,Fast and Furious 6 (Film Appreciation),"Car chases, car wrecks, fight scenes, and down-shifting is director Justin Lin's Fast and Furious sequels. Hobbs (Johnson) has a case that deals with Letty (Rodriguez) who is suppose to be dead and the love of Dominic Toretto (Diesel). Hobbs goal is to track down Letty's leader, Owen Shaw (Evans), who has a device that can cause widespread destruction. Toretto's goal is to find Letty and bring her back home to her family that includes: Brian O'Conner (Walker), Roman (Gibson), Han (Kang), Gisele (Godot), and Tej (Bridges). There are a lot of action and comedic moments that make the movie very entertaining. There are many fight scenes that are unrealistic and hard to believe events could actually happen. Overall Fast and Furious 6 is a very entertaining movie that held your attention throughout the entire movie.",bigeflockhart51,"May 29, 2013"
8,"You don't know me, but you're about to...",No content,r-poldermans,"Jul 20, 2020"
7,One of the best F&F with good story,"Summery : This is one of the best movie in series.It was all about cars. This time, it is not just cars, it's more on speed with less cars. Story is nice to make you seat. Movie is quite fast with some mix action. Some fight scenes made realistic but some are not. Anyway, at few things you think about how could they do it ? But they are doing it.All the cast and crew have worked great. Action sequences are awesome, breathtaking. Plot is good & keeps you with it.Why watch: This movie is not about cars as I said before. It has a story. Really good actionWhy not: It's an entertainment with hardly at few places you think it's not possible or why they ? For that I won't say anything about story, you must watch it.Overall: 7/10",phadvijayanand,"Jul 7, 2013"
8,My Personal Favorite Fast Film,"Fast and Furious 6 is my favorite film in this franchise thus far. I will say I enjoyed it even more than Fast Five. While Fast Five, from a critical standpoint, is better I had a bit more fun with this film. It is amazing to see where this franchise has gone throughout the years. This franchise went from films about street racing to straight-up action and adventure films, starting with Fast Five. Some people might not care for the change but I, personally welcome it. This film continues in that direction and I found it to be the most entertaining. There is nothing deep about this film. This film will not win any awards but it is not supposed to. This film, as well as the other Fast and Furious films, is meant to entertain, and I think it definitely succeeded.The cast from the previous films all reprise their roles here. The characters are all still enjoyable and play off each other very well. I love the banter between the characters. I thought this film had some of the best comedy of the series.Unlike the previous films, this film feels more like Vin Diesel's movie. In the first two films Brian O'Connor (Paul Walker) was definitely the main protagonist. In Fast and Furious and Fast Five I felt Paul Walker and Vin Diesel were dual protagonists. Here Toretto feels more like the main protagonist. I do not mind this because of the plot of this film and because I like Toretto better than Brian anyway. I especially like his scenes with Letty. Brian is still important though, and goes through his own arc as well.Letty, played by Michelle Rodriguez, is back in this film. The way they explain how she survived in Fast and Furious, I thought was lame and implausible. However, she does have more to do in this film. In the first film she was one of the side cast and did not do much. In Fast and Furious she was only in the opening. However, in this she is given more screen time, more to do, and a pretty decent in the middle and end of the film. The scenes she shares with Toretto I liked as well.The villain Shaw I really like in this film. He's easily one of the stronger villains. This is probably because he has so little competition. The Fast franchise's main problem was its villains. The villains have always been weak and uninteresting. Shaw, I think is a big step up. I like that they make Shaw the antithesis of Toretto and his code. The incorporation of Letty makes this a very personal story for Toretto like Fast and Furious, which I like.The action is very loud, fun, and intense like in Fast Five. The effects are great too. There is CGI, but I think it is used effectively. Like in the last film, this film puts more emphasis on action and gun fights rather than racing. However, there are still one or two races that are incorporated, which I found to be enjoyable. Since my theater only shows movies in 2D, I cannot comment on the 3D aspect of the film.Overall, this was a great time at the movies. If you are a fan of the Fast Franchise, definitely check this one out. The ending scene during the credits was also amazing. Like Fast Five it won't win any awards but, for what it is, it's at the top of its class as far as action movies today.",mitchell5954,"Aug 17, 2019"
6,The Vidiot Reviews,"Fast & Furious 6The best way to curb street racing in your community is to generate constant gridlock.Mind you, the racers in this action movie are inclined to go off-road.Dominic (Vin Diesel) comes out of hiding to help DSS agent Hobbs (Dwayne Johnson) stop a rogue solider (Luke Evans) from selling an EMP on the black market.In exchange, he and his crew (Paul Walker, Gal Gadot, Jordana Brewster, Sung Kang, Tyrese Gibson, Chris Bridges) want amnesty for their US crimes and the freedom to return home.The fifth sequel in the series, Fast 6 doesn't dazzle like its predecessor Fast 5 but it does maintain the franchise's new espionage angle.And while street racing takes a back seat in this one, there are enough overblown car- chases, unexpected cameos and sudsy melodrama to propel the series onward.But, as always, this series ignores the real victims of street racing: ran-over flag-girls. Yellow Lightvidiotreviews.blogspot.ca",capone666,"Dec 12, 2013"
4,Last third of the movie went from bad to worse.,No content,nicperreau1710,"May 26, 2013"
