Rating,Title,Content,Author Name,Date
7,Still not believable in action but ups its story one more than Fast Five (2011),"By this point in any movie franchise, if a series of films all related and connected to each other reach beyond two sequels, there must be a loyal following behind it. That also means something is being done right to the franchise (for some). Now although Universal's The Fast and the Furious (2001) feature film debut and subsequent sequels all do not have glowingly positive and overwhelming reviews, the production managed to find its demographic. When The Fast and the Furious: Tokyo Drift (2006) came out with writer Chris Morgan and director Justin Lin handling the project, who would've suspected that they would have collaborated for three more films in the franchise. Amazingly even with writer Chris Morgan back tracking by introducing a later sequel earlier, the franchise persuaded its loyal fans to stick to it and keep following the later entries.After breaking free of the law and living in a secluded life from trouble, newly appointed father Brian O'Conner (Paul Walker), wife Mia (Jordana Brewster) and Dominic Toretto (Vin Diesel) finally could enjoy the time they always wanted together. Or so they thought; Luke Hobbs (Dwayne Johnson) returns to Toretto showing him recent pictures of what Dominic thought was his dead girlfriend Letty (Michelle Rodriguiez) who turns out is working for a group deadly mercenaries headed by a man named Shaw (Luke Evans). Upon this newly discovered information, Hobbs and Toretto agree that if Hobbs gets Shaw, Toretto will get Letty. So in order to capture Shaw, Toretto regroups once more with the crew he gathered from Fast Five (2011) in hopes reclaiming Letty and helping Hobbs out. For what started all the way back in The Fast and the Furious: Tokyo Drift (2006), Chris Morgan's screenplay finally,....finally realigns itself to the timeline it initially broke from. Out of all things, this was one of the most crucial things that needed to be fixed and by golly it's wonderful to see everything add up again.But aside from this, Morgan shows that he had an appreciation and respect for the films he did not write for earlier because of how he treats the characters. Dominic Toretto's underlining factor to why he's so good is because of the family he has. In the early entries it was about racing, hot girls, slick cars and understanding one's place among all that. Later on, it turned into revenge and then fleeing the law. Now, it's just about family. It doesn't get anymore selfless than that and it feels more genuine than ever among all the previously established characters (including the recently new ones). Now everyone works together for a common cause. There's no second-guessing this anymore and that's just the writing alone. The fact that this is written into the script and the actors can pull it off without having to act as so much as being themselves is also a plus. The installments before this did have emotion and arguments related to family matters, but this film feels authentic in every sense of the word when it comes to feelings.Every actor plays off each other like it was another day in the life of the job they do daily. There's no tension at any point between any of Toretto's crew because they know what makes each other tick and that makes it all the more preferable to see when it comes to interactions. Luke Evans also feels like the most formidable villain Toretto and O'Conner have ever come up against. Not only is he smart, agile and callous but also tends to be one step ahead of Toretto and Co., even Hobbs. For once, Toretto can't keep up and to see him challenged is definitely a new thing. The action that ignites between Toretto and Shaw's gang is much more interesting to watch this time too. Although it is still way over the top (if not more than before) and the physics behind such reactions remain unlikely, the sequences feel much more creative this time. This is probably due to that this particular plot is no longer a heist; it's more of a rescue.However that still does not go over easy when people go flying into things or roll around in cars and handle walking it off only with a few scratches. Some of these particular events are simply impossible for the human body to withstand at once or all in one day. Sometimes it feels almost like a superhero movie because of how invulnerable some of these characters are portrayed. Again though, it's only for certain scenes. Stephen F. Windon again gives his audience the usual airy and spacious cinematography that almost every other entry in the franchise has received. Lots of road and aerial views for audiences to see how big of an issue these chase scenes get. The music is a puzzling choice however. Instead of Brian Tyler scoring the film, this time composer Lucas Vidal is doing the job. This is Vidal's only mainstream film score and to be honest it sounds a lot like Tyler's anonymous music. I guess Tyler was over scheduled for other films this time. Nothing sounds that much different though; it does sound good but not memorable in any way. It's just there like all the other scores to this franchise. All in all though it is still one of the better films.Justin Lin's latest entry contains lots of the same generic music and over-the-top action that feels physically flawed, yet it entertains better with Luke Evans' imposing presence and a story that is more about unity than it is about who has the faster car. Also after watching this, the confusing timeline will finally come into place.",breakdownthatfilm-blogspot-com,"Jan 19, 2015"
7,one of the better ones,"So, I am rewatching the fast movies again and this one is one of the better ones. Everyone says these guys are just street racers and how can they be this good or do these things but if you watch the movies in order they learn and become better in every movie. I like this one having some comedy and good action and if you just go into it with wanting to have fun and see Paul, Vin, and The Rock kick some ass then this movie is for you.",bosimmons-44782,"Nov 30, 2021"
9,The best one so far,No content,coolking411,"Mar 6, 2014"
6,Above average below expectations,No content,ravi_maniyar_2007,"Jun 3, 2013"
8,Occupy that room for improvement!!,Based on the amount of running time I think the plot was well executed. Apart from a few goofs here and there I think the car chases were superb. Also the character would need to get facts right on cars especially the V12 American muscle! Most of the scenes repeat in terms of cars on the road which are seen on multiple scenes. The introduction of newer cars is also superb typically the Nissan Skyline driven by the Late Paul Walker. I think Hobbs role has also been well done. Many factual errors occur especially in the last bit of the tank scene and the chain that hangs on the bridge together with reality versus action. The Antonov also takes too long to lift thus causing an unrealistic situation concerning runway length. Its a great title but not necessarily for anyone obsessed with facts rather than fiction mostly on the last quarter. We would also have loved it better in 3D the 3rd dimension of things would bring a bit more realism and adrenalin. All the same I think that was nearly excellent. Good Work!!,lesolonkah,"Jan 17, 2014"
7,They got a tank.,"This story about super-heroic street racers is really about friendship, just like those enduring sci-fi geekouts. The purpose of all the fancy terminology and delirious spectacle is merely to make the essential information more understandable to a younger audience.In the same way, ""Fast & Furious 6,"" arguably the most sentimental of the ""Fast"" movies, is a case in point. All of the regular cast members are in their forties or close to it.This time, the former street racers and carjackers who have become the A-Team resurface to assist in a global counterterrorism manhunt. What could persuade these millionaires, who are now all residing in remote tropical hideaways, to assist the federal government?Although ""Fast 6"" is enjoyable, it could have been even better if it had acknowledged that human touch is uncommon and that once you have it, there is no need to keep clenching it into a fist.",Mysterygeneration,"Aug 25, 2022"
8,Good but not the best,"We're at the sixth movie of the high speed franchise. Dom and his gang are recruited to capture mercenaries who want to create a weapon that will destroy the world. I might as well tell you guys how I feel about the other movies. The first one is good, I know it's a Point Break rip off but it still feels different kinda like Home Alone 2. The second one is good or decent, not bad, I can write one or two paragraphs on this but I won't bother. The third one is decent for sure and it's the worst. It's a spin off, not exactly a sequel and it easily could have a straight to DVD movie. I allowed myself to see it three times and I won't watch it again. The fourth one is good and it's the first true sequel because Vin Diesel and Paul Walker are in it, not just one of them. The fifth one is the best, it's a heist movie and Dwayne Johnson's character Luke Hobbs is introduced. Back to Fast Six, it's bigger than the previous movie but not better. The plot is thin, it's bloated and Hobbs is no longer an antagonist. Before the premise was announced, I thought Hobbs would still be chasing Dom and his gang and maybe they would be forced to work together again. Hobbs is still interesting, he doesn't have any boring conversations with Dom but their previous relationship was better. Who knows, maybe they will become antagonists later on. The action is good and yeah it's ridiculous. Dom is like a superhero and the Iron Giant just popped into my head. There's no shaky cam bullshit and there a lack of CGI. The villain is insane mercenary Owen Shaw played by Luke Evans. He is cliché but still threatening. He doesn't say why he wants to destroy the world, maybe he feels some destruction will help improve the world later on. Unlike the last villain, he doesn't sit around doing paperwork, he drives around and hurts a few people. He smiles during the tank scene which shows he's sadistic. This movie is lighthearted, it's not gritty like Fast Four or the Dark Knight trilogy or the upcoming Need For Speed movie which I'm looking forward to. There are some jokes and most of them work. I didn't write this review earlier because I didn't feel like writing any reviews and I recently decided I should write some reviews because I enjoy writing. Fast Seven will be coming out on April 2015 and only time will tell if Brian will get killed off. James Wan is the director, Justin Lin dropped out because he naturally wants to do other movies. I read James wants the action to be more realistic and I like that idea. I also like Jason Statham who is playing the villain and I read he doesn't want to destroy the world. Okay I'm done yapping.",ty-jensen,"Dec 23, 2013"
7,Like but....,No content,markbolt74,"Nov 21, 2014"
3,Lame to say the least,"This film was properly lame, i only watched it because 21 and Over had been cancelled. I was astounded by how stupid some of the scenes are and some of the main parts of the storyline are 1: horrendous and 2: completely unrealistic and just plain stupid. If you want to watch a properly crap film then this is the film for you, and when the titles start rolling just run out of the cinema. The acting was pretty lame, and I am sick of seeing Dwayne Johnson in all of these sort of films. i haven't yet seen any of the previous Fast and Furious Films, but I do not plan on, judging by how bad this film was. i am quite glad that the next films in the series will have a new director, for humanities sake, I also think that a new cast, and crew, definitely a new writer, or even just cutting the films altogether would make a massive improvement!",edwardo-walsh,"May 24, 2013"
7,6th film in F&F series is not great as its prequel but an above average film.,No content,yashrajs536,"Jul 6, 2015"
7,Amazing furious,"Selection of Vin Diesel and Dwayne Johnson, and the line-up of actors from the previous films makes this film very impressive. Through this film, viewers were exposed to what actually happened to Letty in the fourth film (Fast & Furious). The film begins with the introduction of the cast with gazette from the previous Fast franchise playing in the background. This is very creative as viewers get a glimpse of the previous story lines. The car chasing scene between DK and Han on the road of Tokyo and 'Jason Statham' appearance at the end of this film is not only surprising to the audience but also provides clear picture of what's happening and creating exciting new plot for this movie sequel which is also the sequel to The Fast and The Furious: Tokyo Drift.",murgy86,"Sep 24, 2013"
6,Status quo,"""Fast & Furious 6"" gives the series' rabid fan base pretty much everything it could possibly wish for: an array of uber-expensive, souped-up racecars; a heavy helping of in-group camaraderie; a bunch of super-macho posturing (even from the women); a bevy of scantily-clad, slow-motion groupies; a moderate dose of tough-guy sentiment (nothing too girly though); a smidgen of comic relief; a raft of ear-piercing gun battles and, of course, the series' patented trademark, a whole mess of turbo-charged chase scenes.The plot - since contractual obligations demand there be one, I suppose - involves our favorite band of car racing outlaws (Paul Walker, Vin Diesel, Sung Kang, Tyrese Gibson, et. al ) coming out of ""retirement"" in various foreign lands to help Dwayne Johnson's DSS agent take down an international heist gang in exchange for full immunity for the crew back in the States. There's a lot of talk about ""the family"" and much romantic palaver between Diesel and Michelle Rodriguez, but that's basically just filler between all the spectacular (if scarcely plausible) race sequences - which is as it should be when you're fast and furious.""Fast & Furious 6"" ends with one of those ""don't try this at home"" provisos, which in light of the recent tragic fate of series star Paul Walker, seems more vital and relevant than ever (not to mention ironically prescient). Heed the warning.",Buddy-51,"Jan 22, 2014"
10,Fast 6 & Extra Details,No content,kyle-foster23,"May 24, 2013"
7,Fast & Furious 6: Nitro in the Veins and Punches to the Jaw,"Ah, the return of the brothers of motor oil. When Dom Toretto says ""Family,"" you better brace yourself, because at any moment, he might drop a presidential-level speech between two high-octane chases. Here, Justin Lin isn't holding back. We've got a team of mercenaries straight out of a Call of Duty mission, chases that could make Mad Max blush, and fight scenes that hit harder than a shonen anime mid-power-up.Critics said they'd drifted too far from street racing? Buckle up and shut up, because this movie is fueled by nostalgia and diesel injected with Red Bull. The chases are choreographed like the final battle of Street Fighter, complete with mangled metal and explosions galore. Special shoutout to the tank scene-the moment you realize that gravity is just a suggestion Justin Lin chose to ignore.Between Vin Diesel delivering lines like an NPC in Skyrim and Dwayne Johnson slapping people so hard he could send Thanos into early retirement, the team is stacked. Add in the return of Letty, who we all thought was six feet under back in Episode 4 (like a video game boss who refuses to stay dead). Tyrese Gibson handles the one-liners, while Ludacris plays the tech genius hacking systems like he's Neo in The Matrix.If you're looking for deep dialogue, go watch Dead Poets Society. Here, conversations are just pit stops between stunts. The shootouts are as precise as an aimbot, the explosions are tuned to wake the dead, and the car chases... Think Mario Kart on cocaine with tanks and planes. Yeah, that's Fast & Furious 6.The real star of the movie? The concept of family. Dom could probably solve geopolitical conflicts with his speeches about how ""together, we're stronger."" It's borderline religious. You half-expect him to bless you with the holy trinity: Nitroglycerin, Fistfights, and Family. And somehow, it works. You'll find yourself getting misty-eyed during a reconciliation scene... until a truck explodes and reminds you why you're really here.Fast & Furious 6 is like a greasy kebab after a night of heavy drinking. It wrecks your stomach, but damn, it feels good. If you're craving deep reflection, go watch an indie film about Norwegian existentialism. But if you want flying cars, sweaty muscles, and explosions worthy of a Dragon Ball Z finale, then step on the gas. Dom Toretto is waiting, with a tank full of nitro.",OniFR,"Feb 8, 2025"
8,"Telegraphed, and I loved every moment!","To say this is a guilty pleasure would be putting it mildly. Since the first time I saw 'The Fast and The Furious' 12 years ago, I knew I found my car/mayhem fix. Although I never thought it would last to see iteration #6, I was more eager this time around than for the first. No surprises, besides the unpredictable nature of Owen Shaw. The only real curveball was the substantiation of an Internet rumor that Jason Statham joined 'Fast 6'. Well, sorta -- end credits. After the audience ""ooooohh's"" at Statham's revealing, I couldn't wait, yet again, for the 7th! Fun factoid: This movie marked the reuniting of 2 'Lock Stock and Two Smoking Barrels' characters. Jason Statham (Bacon) and Stephen Marcus (Nick the Greek) playing the CCTV supervisor opposite Lucas Hobbs. :)",Solarwinds78,"May 31, 2013"
6,Finally feelings took over the muscles,"We all know up to now Fast & Furious has been one of the most successful movie franchises. I remember the time when I watched the first part of Fast & Furious. I really fell in love with this movie! I loved every single detail about it: story line, actors (that was when I knew about Vin Diesel and Paul Walker and got addicted to them), cars, but mostly car races. Then there was the second part of Fast & Furious that was not less interesting and exciting. I thought there wouldn't be any continuation, but deep inside hoped for that. And then, some years later, Universal Pictures announced the release of Fast & Furious 3, then 4, and 5. I was anxious to see those parts and loved them. But, frankly speaking, already starting with Fast & Furious 4 I was getting bored. There were less and less new things in the movie and it looked like this franchise started to be exhausted. With the release of the 5th part, honestly, I hoped it would be the end. But, as you know, this year we saw Fast & Furious 6.I admit, I expected too much from this part. I believed the director and producer would add some new things, new intrigues, but in reality everything was the same, just like in previous series. Here the story repeats again: in order to get freedom and clear his crew's criminal records Dominic Toretto (Vin Diesel) has to cooperate with the agent Luke Hobbs (Dwayne Johnson) to help him to take down a criminal organization led by Owen Shaw (Luke Evans) and in which Dom's presumed-dead ex-girlfriend Letty (Michelle Rodriguez) is involved. Of course, there are fights with superman deeds (for example, when Dom saves Letty from falling out of the track), a bit of car races, shoot-outs, some humor scenes. Everything is just like in previous parts. But at the same time there are some attempts, unexpected though, to insert into the story line moral and human notions, such as love, feeling, freedom, betrayal, friendship. I can't say it worked. For me it looked a bit awkward. Imagine the scene where the fight is at its highest point and suddenly a jockstrap declares his love to the girl (the moment when Dom is talking to Letty when he finally meets her). And there are lots of such scenes. What I am trying to say is that for many people Fast & Furious is an action movie where people are not only used, but they require action, a lot of action. And now the director in order to prolong the existence of this franchise tries to turn it in some kind of soap opera by adding all this moral and emotional elements that don't match at all even with the characters. When you expect tough races and fights, but instead you get gentleness and tears – this is a bit confusing and disappointing and even boring.Well, my general opinion is that Fast & Furious has exhausted. It doesn't have anything new to suggest to its audience. Now, this movie is not about the cars and action, but about the morality. So, if you want to see a film full of fights and intrigues, you'd better chose something different. And I don't think the 7th part will be different, don't have any expectations from it. But we will see",eatakmakova,"Dec 30, 2013"
10,Fast 6 contains some spoilers,No content,nickfree321,"Feb 2, 2014"
7,Film #6: Letty's rescue mission that takes the franchise to England and Spain.,"This was a solid entry and film number six in the Fast and the Furious franchise. It joins Brian and Mia in The Canary Islands for the birth of their son Jack...and it brings Federal agent Hobbs back to ask for help taking down a new bad guy by the name of Shaw (Luke Evans). Why would Dom and his crew help out? They are rich and in countries with no extradition treaties with the U. S....but Hobbs brings a photo of Letty alive and well. That is all it takes and the crew is reassembled to join Hobbs in London for a one time opportunity to rescue Letty and get pardons.Great stunts, a cameo by singer Rita Ora, fun comedy like the vending machine bit, and the crew back together are what make this a must see for fans of the franchise. This film reunites Dom, Hobbs, Brian, Mia, Roman, Tej, Han, Elena and Gisele with appearances by Stasiak and Braga for franchise fans. (Oh! And a big call back to the first film and 1327.) I actually really liked how they started this film with a little visual run through of all the films in the series thus far. It was fun to see and helped everyone get on the same page as far as what has come before.Typical hot cars and muscle cars...but new to this entry a tank and a cargo plane. They seem to be upping the ante with bigger and bigger bad guys. Shaw is the mastermind behind some plot to take down the world...almost James Bond villain-y, in fact there is even a Bond joke thrown in. Which was appropriate since they were in England. By the way I loved seeing a British pawn shop.Must see for fans of the franchise and still probably a recommendation for fans of action films. This probably will not topple my favs in this franchise...but might still beat Tokyo drift and the second film which introduces Roman in Miami.My order of favorites in the Fast and The Furious Franchise:
1. Remains the most memorable and the tightest story...the original The Fast and The Furious film in LA
2. Film #5 The whole crew reunited in Brazil
3. Film #4 Letty's revenge and Brian and Don's reunion back in LA
4. Film #6 Letty's rescue...Brian and Mia are parents, England and Spain
5. Film #3 Tokyo drift aka the franchise goes back to high school, Japan
6. Film #2 Roman's introduction, Miami.",cgvsluis,"May 31, 2023"
1,Most overrated film since the Avengers,"Are you f u c k i n g kidding me? I guess this got positive reviews because compared to the other installments in the franchise, this one is like a masterpiece. But still absolutely ridiculously stupid & can barely be called a film.Not sure what we are supposed to take less seriously: Paul Walker's acting, Vin Deisel's monotone delivery, or that this is the 6th one of these pieces of garbage. Is this all Hollywood has to offer us these days? Reboots, remakes, and sequels? May as well continue the theme of making board games into major motion pictures because this is just absolutely horrendous. Fast and Furious is slowly becoming the Police Academy of our time. See you all again at Fast Fingered 14",GodofGSXR1977,"Sep 8, 2013"
6,Fast & Furious 6,No content,Scarecrow-88,"Sep 6, 2014"
7,The best of the whole franchise!,"I have seen all the movies and this one is always my favorite! It's thrilling to watch it scene. You think the movie is done at the end but they have a complete twist that keeps you on the edge of your seat.
Paul Walker is always an enjoyment to see, Vin Diesel not so much. I hated how he had no emotion in every scene. I remember seeing him in the Pacifier and he had so much energy when acting. It's just a disappointment. There weren't any stand out actors/actresses in this film.
The fights scenes were insane and awesome. Everyone did a great job. The scene with the tank was pretty unreal when watching it. However, the one scene I hated was when they killed off a character that had more meaning than the others to another character.
Fast and Furious never disappoints.",brooke-98054,"Apr 13, 2020"
7,Gets more fast and more furious,No content,myblueblazer,"May 30, 2023"
8,Growing it shall,No content,texzhd,"Jul 31, 2013"
6,Fast and Dubious 6,No content,Rob_Taylor,"Jul 22, 2013"
8,Easily worth the price of admission,No content,jackmeat,"May 28, 2013"
7,'Fast & Furious 6′ is a ridiculous action spectacle that will garner more chuckles and applause for fan favorites than it delivers genuine thrills.,No content,bryank-04844,"Aug 23, 2015"
8,An exhilarating sequel! Maybe a bit too exhilarating....(If there is such a thing),No content,callanvass,"Nov 1, 2014"
