,Rating,Title,Content,Author Name,Date,Year
57,10.0,Thrilling fast 5🔥,"Fast Five is a high-octane action film that serves as the fifth installment in the popular Fast and Furious franchise. Directed by Justin Lin and released in 2011, the film continues the story of Dominic Toretto (played by Vin Diesel) and his street racing crew, who have evolved from simple racers to international thieves. The film's storyline is a thrilling mix of action, heists, and car chases, with a healthy dose of humor and camaraderie among the characters.

The plot of Fast Five revolves around Dom and his crew, which includes Brian O'Conner (played by Paul Walker), Letty Ortiz (played by Michelle Rodriguez), Han Seoul-Oh (played by Sung Kang), and newcomer Gisele Yashar (played by Gal Gadot). The crew is living off the grid in Brazil after being framed for a heist in the previous film, Fast Four. They learn of a plan to steal $100 million from corrupt DEA agent Luke Hobbs (played by Dwayne Johnson), and they decide to take on the job in order to clear their names and set themselves up for the future.

The heist is a complex and well-executed plan that involves breaking into a heavily guarded vault, stealing a variety of cars, and making a daring escape through the streets of Rio de Janeiro. The action sequences in Fast Five are some of the best in the franchise, with breathtaking car chases, high-speed pursuits, and a spectacular bus-crashing finale. The film's stunt work and practical effects are impressive, and the use of real cars adds a level of authenticity to the action that is often lacking in other action films.

One of the most notable aspects of Fast Five is its characters and the chemistry between the cast members. The return of Han, who was presumed dead in the third film, adds a layer of emotional depth to the story, as Dom's relationships with his crew members are tested throughout the film. The introduction of Gisele and the development of her bond with Brian add new dimensions to the characters, and the dynamic between Dom and Brian is further explored as they navigate their roles as fathers and partners.

The film also features a return to the franchise's roots as a street racing movie, with several high-stakes races that showcase the skills of the various characters. These races serve as both a way to showcase the impressive car modifications and the sheer skill of the drivers, as well as a means of building tension and excitement throughout the film.

Justin Lin's direction in Fast Five is aggressive and stylish, with an emphasis on speed and movement that keeps the film moving at a breakneck pace. The film's editing is sharp and precise, with quick cuts and tight shots that keep the audience engaged and on the edge of their seats. The cinematography is also noteworthy, with the stunning locations of Rio de Janeiro and the beautiful cars serving as a visual feast for.",nathantinashemugwadi,2024-12-17,2024
105,10.0,Fast Five,"""Fast Five is an electrifying, action-packed thrill ride that redefines the Fast and Furious franchise. Director Justin Lin masterfully orchestrates heart-stopping stunts, high-octane chases, and intense hand-to-hand combat. The film's clever heist storyline brings together a dream team of characters, with Vin Diesel and Dwayne 'The Rock' Johnson forming an unstoppable duo. The chemistry between the cast members is undeniable, making their banter and camaraderie as enjoyable as the film's adrenaline-fueled sequences. With its sleek cars, stunning locations, and pulse-pounding action, Fast Five is an unforgettable blockbuster that sets the bar high for the franchise's future installments.""",vtdqf,2024-12-17,2024
66,10.0,Great addition to the sequel,"This is the best of the sequel so far , with the addition of Dwayne Johnson ""the rock ""it can only make fast 5 a lot more entertaining. The races are also lit with more of the street races. The fast five is the most entertaining of the sequel this far for me no doubt and I'm sure if loved the previous ones You'll agree with me that it's just the perfect.Movie to watch if you love action thrilled movies.If you love watching vin diesel and Paul walker do their thing in the magnificent way they always do with them fast cars , then this will keep you on the edge of your seat 😉.If you haven't watched it yet what you waiting for.",luthertakamartin,2024-12-17,2024
80,10.0,My favorite movie of all time,I love this movie it juss gives u the hood vibes and the way the actors handle the cars it's juss wonderfulDope stunts very creative action I also love the story line and the fact that it puts family 1st .....also love the comedy scenes by tryres Gibson and luda Chris vin diesel is always that tough and soft guy at the same time ...wish to see a scene from Zimbabwe because it has inspired a lot of people this side ...m juss sad Paul walker passed on in real life may his soul rest easy he is one of the best actors of all time ...I can watch this movie over and over again especially when m relaxed at home.,groovazoneent,2024-12-17,2024
70,10.0,A thrill ride like no other,"Fast Five is an action-packed masterpiece that keeps your heart racing from start to finish. This movie takes the franchise to a whole new level, blending jaw-dropping stunts, unforgettable characters, and a story full of excitement and energy.The cast delivers an incredible performance, each bringing their unique charm and charisma to the screen. The chemistry among the team feels real, making you root for them every step of the way. The action scenes are some of the best ever filmed, with breathtaking sequences that will leave you in awe.The film is not just about fast cars and big explosions-it's about loyalty, friendship, and fighting for something bigger than yourself. It's a movie that pulls you in and doesn't let go, leaving you on the edge of your seat and cheering for more.Fast Five is pure entertainment at its finest. If you're looking for a movie that will make you laugh, cheer, and hold your breath, this is the one.",michaelmudimbu,2024-12-17,2024
72,10.0,The best ever,This movie was one of the best movies l have ever seen.l really loved the type of cars that were on the movie and also the actors who were there they made the movie amazing . One of the movies l have always repeated since l started watching movies. This movie should always be on top . I loved the music that was on the movie how they raced their cars and also the cities they really used. When l saw it l couldn't move out of the sofa whilst having popcorns. Honestly guys l don't wanna lie these people should keep up with their content and never back of from producing amazing things like these ones.,tapiwalesley,2024-12-17,2024
75,10.0,A thriller,"What a film. Keeps you on the edge. This is the film that single-handedly got me to give the rest of the series a shot, for better or worse. The scene is beautiful. The actors were brilliant. The suspense, was of just the right dose. Keeps you on the edge and cals you at the same time. I could not ask for more. T's a nice change of pace from the previous films where it abandons the street race angle and goes into the direction of a heist action flick with cars. So yeah, still the best this franchise had, and that's kind of rare for a franchise on its fifth film. The action for the most part is really handled well and a lot of fun to watch. The cast as an ensemble are very charismatic which no doubt makes it more fun for audiences to see a cast that has so much diversity and it's not done with generic stereotypes but just a bunch of people with a common interest. Overall a very entertaining action flick.",thamutyinei,2024-12-17,2024
61,10.0,It's a great movie,"# Impact on the Franchise
1. _Critical Acclaim_: Fast Five received widespread critical acclaim, with many praising the film's action sequences, performances, and direction.2. _Box Office Success_: The movie was a commercial success, grossing over $626 million worldwide and cementing the franchise's status as a global phenomenon.3. _Franchise Revitalization_: Fast Five revitalized the franchise, paving the way for future sequels and spin-offs.# Action-Packed Highlights
1. _Epic Heist_: The movie's central heist, which involves stealing $100 million from a corrupt businessman, is an intense and thrilling sequence.2. _High-Octane Action_: Fast Five delivers non-stop action, with high-speed chases, intense hand-to-hand combat, and explosive stunts.3. _Vin Diesel and Paul Walker_: The chemistry between Vin Diesel (Dominic Toretto) and Paul Walker (Brian O'Conner) is undeniable, making their characters' friendship a highlight of the movie.",ruvimbolyf,2024-12-17,2024
95,10.0,Action-Packed Masterpiece: Fast Five,"Justin Lin's ""Fast Five"" is an adrenaline-fueled, visually stunning cinematic experience that redefines the boundaries of the action genre. The fifth installment in the ""Fast and Furious"" franchise, ""Fast Five"" is a masterclass in high-octane action, cleverly crafted characters, and pulse-pounding suspense.The film's narrative is expertly woven, bringing together a diverse cast of characters in a complex, yet engaging storyline. Dominic Toretto and Brian O'Conner are back, this time teaming up with a group of skilled thieves to pull off a daring heist in Rio de Janeiro. As they navigate the treacherous underworld of organized crime, they must also contend with the relentless pursuit of a federal agent.The action sequences in ""Fast Five"" are nothing short of breathtaking. Lin's innovative direction and the film's clever use of practical effects create a truly immersive experience. From the opening train heist to the film's show-stopping finale, the action is fast-paced, intense, and expertly choreographed.The cast delivers impressive performances across the board. The chemistry between the leads is undeniable, and their characters' complex, often tumultuous relationship is expertly explored. The supporting cast adds depth and humor to the film.One of the standout aspects of ""Fast Five"" is its clever use of nostalgia. The film pays homage to the franchise's roots while also introducing new characters and plot elements. This approach allows both longtime fans and newcomers to enjoy the film equally.The technical aspects of the film are equally impressive. The cinematography is stunning, capturing the vibrant colors and lush landscapes of Rio de Janeiro. The film's score is pulse-pounding and energetic, perfectly complementing the on-screen action.The movie is an exceptional action film that exceeds expectations in every way. With its talented cast, innovative action sequences, and clever storytelling, it's a must-see for fans of the franchise and action enthusiasts alike.If you're a fan of high-octane action, clever storytelling, and memorable characters, ""Fast Five"" is an absolute must-see. Even if you're new to the franchise, the film's engaging narrative and well-developed characters make it easy to follow and enjoy.",jonasiknowledge,2024-12-17,2024
85,10.0,"Adrenaline-Fueled Action at Its Best! Fast Five is an electrifying, action.","Fast Five is an electrifying, action-packed thrill ride that will keep you on the edge of your seat from start to finish. Director Justin Lin masterfully weaves together a complex web of high-stakes heists, heart-pumping street racing, and intense hand-to-hand combat.The film's talented ensemble cast, led by Vin Diesel as the charismatic Dominic Toretto, delivers memorable performances that add depth and humor to the story. Dwayne ""The Rock"" Johnson is a standout as the formidable federal agent Luke Hobbs, bringing his signature blend of wit and toughness to the role.The movie's pacing is expertly calibrated, with each scene seamlessly flowing into the next to create a sense of relentless momentum. The action sequences are breathtakingly choreographed, with impressive stunts and heart-stopping suspense.Overall, Fast Five is an exhilarating, entertaining ride that's sure to satisfy fans of high-octane action movies. With its talented cast, razor-sharp direction, and non-stop thrills, this film is an absolute must-see!*Rating:* 10/10 stars*Recommendation:* If you enjoy action-packed movies with plenty of suspense, humor, and high-stakes action, then Fast Five is an absolute must-watch!",tatendatatsy,2024-12-17,2024
89,10.0,"Shifting from street racing to high-octane heist action, the film expands the scope and scale of the franchise while retaining its core themes of family, loyalty, and adrenali","Fast Five (2011), directed by Justin Lin, is the fifth installment in the Fast & Furious franchise and is widely regarded as a turning point for the series. Shifting from street racing to high-octane heist action, the film expands the scope and scale of the franchise while retaining its core themes of family, loyalty, and adrenaline-fueled thrills.PlotThe story follows Dom Toretto (Vin Diesel), Brian O'Conner (Paul Walker), and Mia (Jordana Brewster) as they flee to Rio de Janeiro after breaking Dom out of custody. In Brazil, they plan an ambitious heist to steal $100 million from a corrupt businessman, Hernan Reyes, while being pursued by relentless DSS agent Luke Hobbs (Dwayne ""The Rock"" Johnson). To pull off the job, they assemble a team of familiar faces from previous films, setting the stage for explosive action.Action & DirectionJustin Lin's direction is sleek and energetic, with well-choreographed sequences and a sense of scale that outdoes its predecessors. The film's standout moments include the vault-dragging finale, an insane set piece blending destruction and precision. The practical effects and stunt work are exhilarating, delivering a balance of realism and blockbuster spectacle.Characters & CastThe addition of Dwayne Johnson as Hobbs brings a charismatic rival to Dom, whose confrontations with Diesel add weight and tension. The chemistry between the cast shines, particularly with Tyrese Gibson (Roman) and Ludacris (Tej), providing comic relief. The ensemble dynamic solidifies the theme of ""family,"" a hallmark of the franchise.Tone & StyleFast Five embraces its over-the-top nature, leaning into action over logic without apology. The shift to a heist format injects fresh energy, making the film accessible to a broader audience while satisfying long-time fans.VerdictFast Five reinvents the franchise, elevating it from street racing dramas to a global action powerhouse. It delivers non-stop entertainment, jaw-dropping action, and fun character moments, marking it as a franchise highlight. It's the film that made Fast & Furious a cultural phenomenon.",ashleykutama,2024-12-17,2024
96,10.0,Good Movie,"The franchise started to change for the better
Introducing Dwayne gave the franchise a massive boost
And ever since this film, the franchise has just got bigger and better!The story is predictable but a lot of fun!It's a very enjoyable film with some really entertaining and truly likeable characters!Vin Diesel is just perfect as Dom!Paul Walker is also really good and he has great chemistry with Vin!To be honest I think the whole of Dom's team have fantastic chemistry!Tyrese Gibson and Ludacris are especially very funny and entertaining!It's great to see Han back too!Gal Gadot is absolutely gorgeous as Gisele!Dwayne Johnson makes a great addition to the franchise too. Definitely one of the best characters in the whole film to be honest!The action is slick and there are a lot of really cool moments!A nice pay off ending too for all the characters!The villain is ok but isn't particularly memorable.This is a truly great instalment in the franchise!",julesmuzenda,2024-12-17,2024
91,10.0,Masterclass,"Dominic my my Vin diesel is generational talent, his acting skills are beyond extra ordinary how i wish they could keep making movies like this till the end of time, because we really need to see more of this in our screens, thumbs up to the directors and the producers this was a world class work that you guys put on and may you keep making great movies like this one. This is like the fifth time today that i have repeating this movie I'm super thrilled, i can not lie this is very very brilliant. I love cars and the way they were working with them honestly i was was overwhelmed by the whole thin big thumbs up.",brizzynyumbu,2024-12-17,2024
86,10.0,Adrenaline junkies will love this,"As far as action films go Fast & Furious 5 is a stunner. If you see it on the big screen be prepared to be blown away by a film that puts every dollar of its budget to great use. Fast Five succeeds where the previous four films have failed, crafting an epic, yet intimate action adventure story that is rooted in character and chemistry. Definitely one of the best ones! Amazing action, cars, solid story, comedic, and very entertaining! What more could you ask for except for epicness! What made Fast Five so special and so vastly superior to its four predecessors is that it was actually a terrific film.",roselindmuguti,2024-12-18,2024
45,4.0,If you like low quality ridiculous action go right ahead,"It's ASTONISHING any of these films beyond #3 have a rating higher than 6. It's another series that lost its way and became a shameless cash grab after the 3rd film. Every other series that does this ends up in the 4s, but somehow this is over 7!Literally 10 minutes into this and already I've seen two scenes that were funny bad. The first scene features a giant American bus crashing at speed sideways into a 1960s muscle car. No I'm joking; that would of course have been BORING, so instead it BOUNCED off the 1960s muscle car and flew over the top into a spectacular rolling motion, leaving the 60s car unscathed. Of course, everyone on the bus walked away from this monumental rolling crash in an old bus with no safety features without a scratch as well. Would never happen in real life doesn't cut it - it's laughably ridiculous. I can't watch stuff like this, it's beneath me. I'd be embarrassed to say I was a fan of this. Do people seriously watch this in the cinema with a smile, wowed by how cool and exciting it was?? Very shortly after this, we see an unfathomably dangerous jump from a train to a car (a now a trope of these films). Spectacular enough you'd think right? Well the writers of this film didn't think so, because they had the two guys drive off a huge cliff at speed immediately afterwards and about 3 seconds after their bodies hit the water at what must have been over 100mph, they came up as if they'd just jumped into a kids pool. Even if I could be bothered with the otherwise average film, these scenes make me get to the end of it thinking I just set fire to 2 hours of my life. It's actually so boring to watch such preposterous nonsense and makes me care less about the rest of it. This is similar writing/production quality and effort as fake TikTok pranks. And by the way, I've only scratched the surface. Half the scenes there's something stupid about it.And what they've done to this series is especially infuriating because the first few are some of the most iconic films to me. They are probably the best look into street racing culture of any films with good car action, good stories, good characters, good acting, good music. There was no need to turn them into generic low quality action movies. But actually what's most infuriating is that these films grew and grew in popularity after they lowered the quality and removed the identity and even got better ratings on IMDB. Any other series and they're in the 4s when they start becoming this low quality. I can't deny as a business they did a great job, but from an artistic, filmmaking and cultural perspective the series is deeeaaaad by this film.All that said, if you like low quality generic action films with this vibe and are quite happy to watch regular people in supposedly the real world do things such as fall from outer space into an active volcano and then climb out 3 seconds later without a bead of sweat these will probably be worth watching.The only things I can genuinely praise are the camerawork and sets and some of the non-action scenes are decent. And I will say they get worse with each one after 3. 4 is decent, 5 is trash, 6 is trash, 7 is a crime against humanity. I have no plans to lose any more brain cells with any newer ones.",blightersaurus,2024-12-18,2024
92,10.0,Fast and furious 5,"""Fast Five"" shifts the franchise into high gear! Director Justin Lin delivers non-stop action, heart-pumping stunts, and witty banter. Vin Diesel and Dwayne ""The Rock"" Johnson face off in an electrifying showdown. The film's clever heist plot and stunning set pieces make it an unforgettable ride. The chemistry between the cast, including Paul Walker, Jordana Brewster, and Tyrese Gibson, adds depth to the film. With its pedal-to-the-metal pace and mind-blowing action sequences, ""Fast Five"" is a must-see for fans of the franchise. Highly recommend that you go and watch it with family .Rating: 4.5/5""",sithokozilencube,2024-12-18,2024
114,10.0,_Fast Five: An Adrenaline-Fueled Masterpiece that Redefines the Franchise_,"I just watched Fast Five, and I'm still reeling from the experience. As a fan of the franchise, I was excited to see where the fifth installment would take us. But nothing could have prepared me for the sheer adrenaline rush that is Fast Five.From the opening scene, it's clear that director Justin Lin has a vision for the franchise that's bigger, bolder, and more explosive than ever before. The film's pacing is relentless, with a narrative that's expertly woven to keep you on the edge of your seat.The cast is, of course, one of the standout aspects of the film. Vin Diesel returns as Dominic Toretto, and.",oniejera,2024-12-19,2024
71,10.0,Best action,Amazing in action enjoyable combination of our well known actors gives a great plot and curiosity for us to see what they have come up with this time What makes it more great this time is their diversion from the usual car racing to focus on a money heist gives it that great big thing and the characters combined makes it more poignant i mean tyrese in a heist gives a great sense of imagination that definately its very nice paul walker vin diesil and the rock makes my imagination run wild. If you just mention this names everyone jus wants to grab it and watch and they rilly nailed it so much great action.,tulidust,2024-12-19,2024
120,10.0,Amazing movie,"Great movie, the fiction is just astonishing, and the car racing always keeps one on his or her toes, Paul walker, vin diesel and other actors really took their time to produce the masterpiece. I enjoyed the suspense, the drama and the comedy in the movies, Great personality of Paul walker is a life lesson. Great cars also, the classic movie falls under the must watch movies . Hatoff to siting and the places the movies were shot from . The action and violence on the movies made it a lot more interesting, The had a great storyline and a wonderful ending also . Do yourself a favor and watch the great of all time.",mfpvzf,2024-12-19,2024
94,10.0,Five Five review,"The is one of the film l found entertaining and thrilling, l always enjoy watching it repeatedly and countless times. I always give credit and thumps up to the producers for coming up with such an idea to produce that film. I personally think producers in the field should produce something like this that suits the current film fraternity considering how technology is moving fast. Fast five film is a film that you can even enjoy watching countless times especially when you feeling bored or sad...l just wish if they can produce another film expressing the same theme. Thumps up to the producers and actors!",raymarongedza,2024-12-19,2024
118,10.0,Craftsmanship,"The moment Diesil show up I know craftsmanship is incharge, the ability to use oblivious incidents for sensation, so breath taking . The story line so appealing so much so that if you would stumble on this movies by mistake, the dopamine rush would leave you asking for more .

The speed the chase you are just gonna seat tight If you wanna cut back on calories after supper then fast and furious is the game extremely exhilarating Nonstop actions power packed movie that resembles technological advancements of our time at its best delivering a cutting edge suspense thrills and spills that could take you on cloud nine n back!!!",kumbiraiduku,2024-12-19,2024
116,10.0,The best there is!,"The best series out there. Following from the start up to this point just gives one goosebumps. But it's not just that you have to follow it from the first series, this part of the series, Fast five, depicts an important story about life, friendship, brotherhood and family at large. From this movie you get to understand that family isn't only built upon blood but even bonds can make up family, outside bonds. You get to learn and understand how crucial bonds are and the extent to which some would go to protect that which they hold dear. It teaches the importance of one another in good or bad. A great movie. Great story line.",hyqxgwg,2024-12-19,2024
