,Rating,Title,Content,Author Name,Date,Year
73,8.0,Wow! I think I have a new Second favorite in the Fast and The Furious franchise!,"I loved it! This action packed, stunt filled, car heavy entry in the Fast and The Furious franchise nave have moved into the slot of my second favorite so far...causing me to reorder the series thus far:1. The Fast and The Furious (held by the first film which started the franchise and will forever remain near and dear to my heart...with a great ""family"" centered plot heavy on respect.2. Fast Five (new to this position...and I am going to call it the gang's all together)
3. Fast and Furious (Film#4 The revenge of Letty)
4. The Fast and The Furious: Tokyo Drift (#3the high school entry set in the future)
5. 2 Fast and 2 Furious (#2...set in Miami without Dom and the gang)Film number five takes us to gorgeous Brazil, specifically Rio de Janeiro's Copacabana and Ipanema beaches, Christ the Redeemer statue atop Mount Corcovado and Sugarloaf Mountain. There are some great shots day and night across the city, including some great running stunt shots in the city's infamous favelas.There are some great stunts and some even better cars and car chase scenes...but what really makes this one of the better films in the Fast and The Furious series is the reunion of so many characters...not to mention that we get back to the great on screen chemistry and mutual respect between Brian and Dom, who are both on the run from the law with Mia. This reunites Dom, Brian, Mia, Vince, Taj, Han, Roman, Gisele, Leo and Santos and it introduces both Hobbs (played by Dwayne The Rock Johnson)and Elena as they team up to take down a Brazilian bad guy named Reyes and steal his money.Lots of local flavor this film starts with a prison break for Dom and then a meet up at Vince's in Brazil where we discover Vince has a son. He and Brian bury the hatchet and agree to do a job together for some quick cash. The job goes south, but gives them a common enemy Reyes. Meanwhile they are being hunted by an elite FBI team lead by the Old Testament Hobbs...who after loosing the majority of his team in a street fight to Reyes' men, joins forces with our guys to take him down.If you are a fan of the series or just a fan of great action films..,I think you will love this film like I do.""Mission impossible to mission insanity!""",cgvsluis,2023-05-31,2023
122,5.0,This is the best?,"All coherent thought is thrown out with this one. Buying into the ridiculous nature still isn't enough to overlook the illogical character flaws. Shutting off your brain to enjoy the massive set pieces is all you can do..
..
All coherent thought is thrown out with this one. Buying into the ridiculous nature still isn't enough to overlook the illogical character flaws. Shutting off your brain to enjoy the massive set pieces is all you can do..
..
All coherent thought is thrown out with this one. Buying into the ridiculous nature still isn't enough to overlook the illogical character flaws. Shutting off your brain to enjoy the massive set pieces is all you can do.",griffithxjohnson,2023-06-01,2023
55,8.0,what movies yarr,Finnaly i watched this uper amzing movie gret movi and direction this is 5 movies of fast series and they crated a masterpiee this movies is for cars lovers if your cars lovers than watch this movi in any case so you will know what vis meant to be cars so lets talk about casting casting is ok i like everyone casting everyone gives thri best no doubt about it sound is grate vfx is grate everthing is grate stunt is also grate team up is grate ten they build a stroy in this movies thatwhy we have reason to watch this movies is the stroy of this movie they are coonecxted to ours lives so watched this movies.,sohamvhadgir,2023-06-04,2023
39,8.0,"Alright, NOW I'm into it.","I'm watching these movies in order and this one is the best I've seen of them so far. The cast did very well and I enjoy these movies for the action and characters and not the side-show/government agency/behind the scenes bs. The action sequences truly deliver and it was very impressive what they were able to do from a filmmaking perspective with the car chases, ideas for new ways of doing them, etc. The fight between Vin Diesel and the Rock plus the twist at the end with the money were clever as well! I'm really glad that I watched this as an action-movie fan and I'm looking forward what they do 6-10!",SPZMaxinema,2023-06-10,2023
17,6.0,It has its moments,"Fast Five is an improvement on its predecessor. The film nicely picks up from the last film to continue the story. Bryan truly ditches his badge and fully commits to Dom and their lifestyle, he is now wanted by the authorities and on the run. This film does well with the storyline around the heist and the high stakes surrounding it. Not only are they gong after a dangerous drug lord but also everyone under his power. Also to add another level of craziness is breaking into the police station to steal his money. There are some ridiculous and unrealistic scenes towards the end of the film. How could Dom pull a locker that is lodged in concrete and drag it throughout the streets as if it was as light as a kite? These over the top and unrealistic scenes bring the film down a bit.",Kingslaay,2023-06-23,2023
15,7.0,Rio Grande,"Ohhh. We're definitely starting to get there now. If ""Fast and Furious"" was the soft reboot to set us on the new path, ""Fast Five"" is a statement of intent for the series going forward.Having been liberated from the Prison transport, the Toretto family head to South America. They reconnect with Vince (Matt Schulze) and, in need of money, get involved in a job stealing cars from a moving train. The job goes wrong, and several DEA agents are killed by men working for local Drug Lord Hernan Reyes (Joaquin De Almieda). Framed for the murders, Dom (Vin Diesel), Mia (Jordana Brewster) and Brian (Paul Walker) become a target for accomplished DSS Agent Luke Hobbs (Dwayne Johnson). Whilst avoiding capture, Dom decides on revenge against Reyes and calls in his friends and family for assistance.We're right at the crossover point here between the family being up against small time gangs to international terrorists. Reyes is still, I suppose, just a drug dealer, but the power he wields in Rio, over the police in particular makes him a much more dangerous opponent. Things are getting more preposterous though. The initial assault on the transport bus would clearly kill everyone on board immediately and whilst the vault heist is great (perhaps still the high point of the whole series, hence it's triumphant return in ""Fast X"") there's no getting away from the fact that they must kill hundreds of people (both cops and innocent bystanders) as part of it.The core of 'La Familia' are together now though, with Han, Giselle, Tej and Roman all together and Elsa arriving into the plot too. They're all relatively lacklustre when weighed against Dwayne Johnson though, who arrives in this series like a colossus and very nearly takes it over - it's clear why Diesel and he struggle to co-exist in the franchise after the next one.We're getting closer to the insanity - which I'm pretty sure starts in the post credits scene of this one and goes from here. Strap in.",southdavid,2023-06-30,2023
2,7.0,Above the standards.,"Fast & Furious 5 delivers action on a grander scale compared to its predecessors. As the team devises heist plans, the colorful atmosphere of Rio de Janeiro adds visual richness. Action sequences and car races remain thrilling, deepening the dynamics between characters.However, at times, the plot can become overly complex, and some characters' motivations could have been better explored. The film's runtime might feel lengthy, with certain scenes appearing unnecessarily prolonged. Moreover, instances where the laws of physics are stretched make the realism waver.In conclusion, ""Fast & Furious 5"" stands out as a chapter that caters to action enthusiasts within the series. With its large-scale scenes and character dynamics, it offers an engaging experience while showcasing some shortcomings in the plot and logic.",uhudsavascisi,2023-08-18,2023
41,8.0,"One of few enjoyable ""Fast"" movies","(2011) Fast Five
ACTION ADVENTUREA much better improvement over the last one which was overshadowed by CGI and some unrealistic car crash sequences, this time has much of the original cast from all ""Fast & The Furious"" movies appearing on this one for doing different things against a powerful kingpin in Rio with the FBI behind it's back sought for Vin Diesel and crew for an incident regarding some murdered deputies! Their are a lot of inconsistencies and plot holes regarding the story line but keeps viewers entertained by many amusing one-liners and is classified as an action adventure with a seen to be believed chase sequence regarding a large safe, hauled by two cars. Obviously inspired by ""For A Few Dollars More"" and ""The Italian Job"" but done with some panache. But what is lacking what the first one has that this one does not is the awesome musical soundtrack which always goes well with young people and driving hand in hand whether a car is driven or not, via techno-pop! I mean, the soundtrack for the first ""Fast And The Furious"" was so catchy that it made CD sells out of the original soundtrack, which this one could've provided instead of some more boring conversations to enhance the story.",jordondave-28085,2023-09-25,2023
43,10.0,Fast Five Review,"Ll time. This film reunites all actors from the previous films. Vin Diesel, Paul Walker, Jordana Brewster , Tyrese Gibson , Chris 'Ludacris' Bridges, Matt Schulze, Sung Kang, Dwayne Johnson, Gal Gadot, Tego Calderon and Don Omar, the gang are all here! They are all cast from the previous installments.The Director brings all new actors in the cast crew: Joaquim de Almeida, Dwayne Johnson and Elsa Pataky. The script, the players, the action scenes, the story. Everything about this film is awesome! This film kicks ass. Is my second favorite best film in the series franchise. This film for me even beats Furious 7. Cause Furious 7 is not that good as this film is. The far of the highest best films ever. It's actually probably my favorite movie that I've ever seen. If you like any of the other fast and furious movies SEE THIS ONE!!!!! It's a Epic movie watch it till all the way to the end.Fast Five picks up, literally, right where Fast & Furious left off. Dom (Vin Diesel) is on his way to prison when his partner, former undercover detective Brian O'Conner (Paul Walker), and his sister Mia (Jordana Brewster) stage a daring (albeit highly unlikely) prison-bus break. On the run from the police, the FBI and the media, the three hightail it across the border and head even further south, all the way to Rio de Janeiro. There, they decide to lay down, lay low and avoid any unwanted attention. Nah, I'm just kidding. They do what any international fugitives would do: rob a train, double cross a local crime lord named Hernan Reyes (Joaquim de Almeida) and his right-hand man Zizi (Michael Irby), put themselves on the radar of a ludicrously musclebound U. S. Diplomatic Security Service agent (Dwayne Johnson), and set out to steal untold millions from Reyes. That's right, it's One Last Heist for Dom and Brian. Not that anyone should be foolish enough to think this is the last we'll see of the led-foot duo; not after Fast Five revved up $600 million at the worldwide box office. (Be sure to sit through the first chunk of end credits for a nice little surprise.) Fast Five boasts incredible action scenes that are all varied and equally exciting. The film is full of clean, well choreographed shots that are easy to watch and the cast works great as a whole unit, making the film's running time breeze by. The heist in Rio De Janeiro was amazing An energetic, high-octane. The film was brilliant and smart it was action fun Entertained. The fight scenes between Dwayne Jonson and Vin Diesel was tremendous. I was happy that they put someone (Dwayne Jonson) in the movie that was so smart like Dom (Vin Diesel) was. Luke Hobbs as A Diplomatic Security Service agent to track down Dom and his crew was awesome! He did a brilliant job In this Action packed sequel film! Just Lin deliver us a high octane Action packed story filled with full of cars and shootings in his film.Vin Diesel, Paul Walker and Dwayne Johnson lead this all-star all-action movie with outrageous stunts, incredible cars and beautiful girls that pushes the limits into the red and beyond! The legendary Dom Torreto (Vin Diesel) partners with outlaw cop Brian O'Conner (Paul Walker) on the opposite side of the law in exotic Rio de Janeiro, Brazil. Hunted by ruthless Agent Hobbs (Dwayne Johnson) and an army of corrupt cops working for a deadly drug kingpin. Torreto and O'Conner reunite the gang from previous Fast adventures to pull off one last job - an insane heist worth $100 million!""Five Times The Action!, Five Times the Fury!""I love this film to death and I love how they were planning to rob a Police Station. The first half was a little boring, but the second half was fast paced entertained filled with action. I love this film and everything about it. I love that it is 2.hrs long so that it can tell the whole story.When developing Fast Five, Universal Studios deliberately departed from the street racing theme prevalent in previous films in the series, to transform the franchise into a heist action series involving cars. By doing so, they hoped to attract wider audiences that might otherwise be put off by a heavy emphasis on cars and car culture. Fast Five is considered the transitional film in the series, featuring only one car race and giving more attention to action set pieces such as gun fights, brawls, and the heist of $100 million. The production mounted a comprehensive marketing campaign, marketing the film through social media, virtual games, cinema chains, automobile manufacturers, and at NASCAR races.",jonatanmm,2023-10-05,2023
29,10.0,All Joined for the Fifth,"The Fast and Furious series has struck us once more with a fifth movie that just keeps getting better and better. New characters, new action, and new drama. Some might say this new action surpasses the laws of physics but is that necessarily a bad thing. What distinguishes this movie from the others is that this is the first movie that gathers the characters from the past movies to create one big team or ""family"". This action movie is not just defined as an action movie, it includes developments of relationships and the creation of new ones thus offering a satisfying mix of emotion and adrenaline. It also highlights the importance of family in difficult times. It has an amazing plot, amazing cast, the greatest development of a family, and surprising plot twists.Fast Five is the first movie that sets the franchise into a new direction. It introduces the franchise into a heist-driven plot where for the first time, the team must not only outrun the law but also outsmart the ruthless drug lord in Brazil, Hernan Reyes. This finally gives the characters a chance to flex their brains as well as their muscles.The casting for this movie could not have been better. You have Vin Diesel starring as the iconic Dominic Toretto, Paul Walker as Brian O'Conner, Jordana Brewster as Mia Toretto, and the newest character Dwayne Johnson as Luke Hobbs. Which better men would you rather watch fighting on your screen than Vin Diesel and Dwayne Johnson. The movie does not only show the power of men fighting but it also showcases the power of women and their abilities through the characters Mia and Giselle.This movie has kept its viewers on the edge of their seats because of the different plot twists. With shocking car crashes, heists, and shootouts that serve as a heart-pounding moment. Every time you think their plan is going wrong or it's going to fail, in reality it would be going exactly as they wanted. It's entertaining to watch how their plan unfolds and then discover the tricks behind it.Fast five has not failed the franchise with its trademark of exhilarating car chases. It has also succeeded in developing its characters and giving the audience a deeper understanding of them. With the relationships growing, the fast family is finally born in Fast Five. Vin Diesel and Paul Walker continue to anchor the series with their charismatic presence, and their bromance is as endearing as ever. Including Jordana Brewster whose character is revealed pregnant in the beginning thus showing the importance of maintaining the family bond.If I were to direct this film, there is not one thing I would change. It's got the cast with the perfect chemistry, the perfect script, and the perfect stunts. Yes, the stunts don't abide the laws of physics, but isn't that the fun of it? Fast Five is a spectacular addition to the Fast and Furious series, delivering non-stop thrills, a charismatic cast, and a heist plot that stirs the franchise in a new direction. If you're a fan of fast cars, big explosions, and heart-pounding action, Fast Five is a must-see. Prepare yourself for a wild ride through the streets of Rio de Janeiro.",nayahaddad-33402,2023-10-06,2023
1,7.0,The Rock Cooks,"The Fast and Furious franchise is one that is mixed in quality, while never dipping too far into being a bad film. Fast Five is one of the better films in the franchise and Dwayne Johnson is definitely the reason for that. While the story starts to feel like too much of the same thing, The Rock comes in as the power house Hobbs to counter Vin Diesel's Toretto. The dynamic between the two action stars creates a rivalry of entertainment. The on-screen chemistry between the entire cast cannot be denied and it is a joy to watch them play off each other, as family. With great effects and captivating stunts, this is a highpoint for these films and has me along for the long ride now.",Ltufano23,2023-10-16,2023
82,10.0,Fast & Furious,If you liked Fast and Furious 4 You will love Fast 5 I loved it so much Fast and Furious is one of my favorite sets of movies. My favorite part of the Fast 5 movies is when Brain. O'Connor and Mia tell everyone that Mia is pregnant and that they are going to have a baby boy. So if you do not watch Fast & Furious you need to start watching Fast & Furious because it is a great set of movies it is all about driving fast and family and their family gets bigger. Mia and Brian have a baby boy and name him Toney and it is number 6 or 7 of the Fast & Furious set of movies Dom finds out he has a son and his son's mother gets shot right in front of him.,Furious2008,2023-10-20,2023
30,10.0,"Fast Five: A Cinematic Masterpiece of Speed, Heist, and Heart","""Fast Five"" (2011) doesn't just push the envelope; it tears it to shreds and leaves you exhilarated, breathless, and utterly captivated. Justin Lin's direction takes the Fast and Furious franchise to unprecedented heights, combining jaw-dropping action, intelligent storytelling, and an ensemble cast firing on all cylinders. This film isn't just a sequel; it's a cinematic juggernaut that sets a new standard for adrenaline-pumping entertainment.At its core, ""Fast Five"" is a high-stakes heist film infused with heart and camaraderie. The chemistry among the cast, including Vin Diesel, Paul Walker, Dwayne Johnson, and the rest of the crew, is palpable. Their camaraderie feels genuine, adding emotional weight to the story. As the team faces off against a ruthless drug lord, the film delves into themes of loyalty, family, and the lengths people will go to protect the ones they love.The action sequences in ""Fast Five"" are nothing short of spectacular. From the electrifying car chases that have become the franchise's signature to the meticulously planned heist scenes, every moment is orchestrated with precision and flair. The film's commitment to practical effects and real stunt work elevates the intensity, making every crash, explosion, and fistfight feel visceral and immediate.One of the film's crowning achievements is its ability to seamlessly integrate characters from previous films, creating a cohesive universe that fans can fully invest in. Dwayne Johnson's addition as Agent Luke Hobbs injects a new dynamic into the series, providing both a formidable adversary and an eventual ally for our beloved crew. The film takes time to develop its characters, allowing each member of the ensemble cast to shine, making their triumphs and challenges deeply resonate with the audience.Visually, ""Fast Five"" is a feast for the eyes. The film captures the vibrant energy of Rio de Janeiro, adding a colorful backdrop to the high-octane action. The cinematography is both stylish and immersive, pulling the audience into the heart of the action. The editing is razor-sharp, ensuring a seamless flow between the film's numerous set pieces.In conclusion, ""Fast Five"" is a cinematic masterpiece that flawlessly blends adrenaline-fueled action, gripping storytelling, and well-developed characters. It not only revitalizes the franchise but propels it to unprecedented heights, setting a new gold standard for action films. For its outstanding performances, expertly crafted action sequences, and emotional depth, ""Fast Five"" rightfully earns a perfect 10/10. Buckle up and prepare for a thrilling ride that will leave you in awe of its cinematic brilliance. Fast, furious, and utterly fantastic, this film is a triumph in every sense.",Pratyush003,2023-10-27,2023
3,7.0,Hard to rate,"I'm kinda done with this franchise, haven't seen a Fast movie since Fast 7.. But I was lucky enough to see the spinoff called Hobbs & Shaw for reasons I'm not able to explain and I heard they went into space in Fast 9 and it turned a lot of people off.. I will admit, when I saw Fast 5 on the big screen I had a blast. I honestly don't think I have ever had more fun in a movie theater. When looking back at it now, this was the beginning of the end. They went from street racing to pure action and I didn't see it coming, this movie had the element of surprise but anything made after this did not. They couldn't figure out how to top themselves to they decided to turn the characters into superheroes.. And apparently Dom has a psychopathic brother played by John Cena.. Never heard any references in previous movies and all of a sudden he's the new main villain.. I mean c'mon.. My 9 year old son can write better stories than that.This movie is arguably the most entertaining in the franchise but it truly was the beginning of the end, it spawned a bunch of sequels where dead characters were mysteriously brought back to life.. And flying cars into space. It's become pointless and stupid. I no longer feel emotionally attached to the characters. They should have ended it right here but sadly that's not the world we live in.",askeland89,2023-12-07,2023
100,2.0,Fast and Furious Five - What happened to the races?,"When I first watched the movie ""Fast and Furious,"" I also wanted to be like Brian O'conner, have an amazing car and race. And, if I can recall correctly, the movie I watched was the first one, the real essence of fast and furious. But I cannot explain how a movie that was based in racing and with some criminal bands that gave a huge range for the story to be developed, turned to be a movie in which racing is no longer racing, and focuses in the most strangest situation in which a car cannot be put, you have a big deal there, mainly for those who liked the original essence of the film.

The reason why I chose this exact movie from the saga is for a crucial factor, it is called Dwayne Johnson ""The Rock."" There is nothing wrong with him, I am really neutral about him regarding his movies, but, if you pay attention to some of his roles in other movies, he is a perfect candidate for a movie with a bunch of special effects and destruction everywhere, for example, San Andreas, not for a racing movie. But it does not finish there, they decide to put Jason Statham as the antagonist, but at least he had some relation with races in Death Race!

I am not saying that the director, Justin Lin, did a bad job. On the contrary, he did a great job leading the saga to a broader action scape, but I would not recommend this film to a person who has watched the first one for the same reason, for the concept of tunning cars, racing, and live life in a different way, a little bit faster. The characters also did a great job, Mark Sinclair Vincent (Vin Diesel) and Paul Walker are excellent for this movie, but it is the direction that it took that made the film forget about its real origins and lose some of those fans who enjoyed more a sound of an engine rather than a car flying to the moon as in the last movie.",argeniscastro-02897,2024-03-10,2024
