,Rating,Title,Content,Author Name,Date,Year
117,8.0,Beautiful film,"Take 5))) Edited))) I found a scythe on a stone, but our scythe will mow down any oblique :))) IS there NO spoiler here or are you reading between the lines?All the previous parts of ""Fast and Furious"" were just a rehearsal before the killer fifth part.Today I have for you the coolest movie of all ""Fast and Furious"", which is definitely superior in terms of the dynamics of events, the stellar composition, the intensity of passions, special effects and simply insane races of Dominic Toretto and Brian Oconner, what they did in this series, in my opinion, it is probably simply impossible to surpass! I have not seen such a drive in any of the parts of ""Fast and Furious"".",kirillchugun,2022-01-19,2022
104,10.0,you will not regret the time spent,"The film that started the new series of ""Fast and Furious"" films, ""Fast and Furious 5"". The film that brought together all the beloved characters from the previous films into one huge ensemble. Add to that Dwayne Rock Johnson, and you have arguably the best thing ever in the franchise. I had a hard time choosing which of the F&F movies is the best/my favorite. 5, 6 and 7 are all great. They know exactly what type of movies they belong to and what type of movies they don't. Perhaps ""Fast and Furious 5"" ranks first for being the first to truly embrace the ridiculousness of the franchise. Even the previous film sometimes felt a tone deaf to the script. However, ""Fast and Furious 5"" takes the series to a whole new level in terms of tone, characters and even genre. In many ways, it was a mild reboot of the series. Essentially, the characters became superhumans with qualities they didn't have before. As far as I'm concerned, Tej has never been a technical genius, Mia has never been able to hack into police scanners, and Roman has never been afraid of anything. All of this was added to serve the story they wanted to tell in Fast and Furious 5. And you know what? I'm totally fine with it. A soft reboot is exactly what these movies needed. If that's what we need to make sure the characters pull off a crazy heist and have a lot of fun? I'm all for it. The Rock (aka the Viagra franchise) adds another layer to the movie. Gone are the days when Dom and Brian attacked each other. Now 260 pounds of pure muscle haunts the whole team, and it's worth it. Not only is it mind-blowingly entertaining to watch Diesel and Johnson fight, Johnson brings a lot to the role of Hobbs. These movies have always sought to create an internal code/moral for each character, and Hobbs' code fits perfectly with and confronts Dom's code. Apparently, this role was originally intended to be played by Tommy Lee Jones, but I can't imagine anyone better than The Rock. Like the previous film, ""Fast and Furious 5"" does a great job of recapturing old relationships, developing new ones, and doubling down on the action. This series is half about family and half about how crazy every stunt and action sequence can be. By this point, they've pretty much abandoned street racing in favor of heists, and it works. Heck, even the one time they have a ""race,"" it happens behind the scenes. The Fifth Fastener is the epitome of what the series has become, and I'm not sure any movie could match the incredible pacing and infectious chemistry between the ensemble members. +Turn on the Rock +Dom vs. Hobbs +Double the emotion and action +Mild reboot serves the series well -Even if some of the character changes don't make much sense.",jibiw-05244,2022-01-19,2022
84,8.0,Impressive sequel,"While the emotion is lacking in this movie, it makes up with amazing race scenes and good comedy, it also does good in building off the 4th movie and the new characters are all funny and developed really well, plus the post credits scene gives us a good cliff hanger for the next movie, so a very good movie, but lacks emotion.",thesterlingweaver,2022-02-27,2022
98,10.0,first time to see it,When I first saw this movie is so excited that the words can't be put together because each scene is fun and exciting all the time. The overall composition makes this movie very good. And it makes me want to watch it again and again. Both the performances of the actors who performed very well. Can send out all the emotions of the characters and proceedings that answer all questions and fun throughout the story And if you're hesitating about whether or not you should watch this? I can only suggest that you should watch it. Because it's so fun give every emotion.,wwongsorn,2022-03-06,2022
38,10.0,One thing i have to say!!,BEST FAST AND FURIOUS MOVIE EVERRRRRRR!!!!! One of the best most exciting action movies ever!!!!!! The entire movie is amazing and i love the ending as well!!,adysonriley,2022-04-30,2022
26,6.0,Flawed but still an improvement,"This was definitely the best entry in the franchise at this point. That doesn't mean that it blows the other films completely out of the water, just that this was better executed.",eadiony,2022-05-02,2022
8,10.0,Awesome movie,I was 12 years old when this movie came out and this was one of my favourite franchises. When i saw the trailer I wanted to go see but never did . Later my friend of mine gave me the whole movie in pendrive and I was able to watch this masterpiece.,saniyasoni-32451,2022-05-20,2022
31,7.0,Almost good,Fast Five is the first enjoyable film of this series in years. It was such a step up and very entertaining but with that being said... the last act was so ridiculous and unrealistic that it takes you out of the movie.,natv-20534,2022-08-01,2022
32,7.0,Racing fades into the background.,"Fast Five. Racing fades into the background. It is probably from this part of the Fast & Furious series that they move from films about racing to action films. But it's still insanely spectacular and some scenes even fascinate the eye. New and old characters fit well into the new story and are in excellent contact with each other (throwing jokes to each other or comparing who has a car faster). Musically, this episode was not so memorable, except for ""Danza Kuduro"" by Don Omar and Lucenzo, no other song comes to mind. Speaking about the plot, it is not as interesting as it was in part 4, and the plot ""we need money and we will rob a rich uncle"" does not go very well.",kelvinselimor,2022-09-02,2022
103,8.0,"Fast Five brings the action, beloved old characters, exciting new ones, and a whole lot of fun to the Fast franchise and the heist genre.","Fast 4 and Fast 5 are the best of the Fast & Furious franchise. Fast 4 redeemed the series after the failure of Tokyo Drift by bringing back Vin Diesel and the cast and family of the first film. Then Fast 5 expands and adds to the crew with fan-favorite characters from across the series, including Han (Kang), Roman (Gibson), Tej (Ludacris), Gisele (Gadot), and more. The Toretto family plans a massive heist to buy their freedom but hot on their tale is Dwayne Johnson's Hobbs, a perfect foil to Diesel's Toretto. The face-off between these characters is epic! Fast Five's bonkers action is a little more grounded than later entries, but it's still outrageous fun. It feels kind of like The Italian Job, directed by Michael Bay. Fast Five launched the Fast Franchise into another decade of insane stunts and stories with great characters and commitment to embracing its cheesy awesomeness.",Paragon240,2022-09-17,2022
40,10.0,The Fast and the Unfaithful,"Fast five, the 5th movie from the Fast and Furious Franchise follows the lives of criminals who consider themselves family. This movie holds a worldly perspective of passion, loyalty, and what it means to live life on the edge. From a Biblical worldview, it is obvious to say that the lives these characters live are not godly one's. Choosing violence, committing multiple felonies, immorality, and drinking. They are not on a path of righteousness. 1 Corinthians 10:31 says, ""So, whether you eat or drink, or whatever you do, do all to the glory of God."" Saying grace over a family meal is one thing, but professing and glorifying God through one's actions, speech, and the people they follow, attest to whether one is pursuing a godly lifestyle or not. As seen in the movie, prayer before a meal becomes the means to their profession of belief. Prayer to God before a meal and having fellowship with family is a great thing; however, their life is inconsistent. Is the movie cinematically well done? Absolutely! Is the movie portraying or promoting a Christian worldview? No. I hope this review is helpful for anyone curious!",mercedesmontoya-12649,2022-12-07,2022
83,9.0,Everything You Want In This Genre,"This movie takes everything that was exciting and thrilling about the previous installments and brings it all together and even in many ways elevates it. The start isn't anything too spectacular , but the moment they bring all of the characters together for the mission is absolutely epic. Sometimes when franchises try to merge characters from one movie with another it is clunky and underwhelming, but all these characters truly come together to form a family. The dialogue is fantastic and the comedy is on point. Every character is used in a way that allows the film to progress nearly without flaw.The only downside I would argue is that the villain was extremely average and checked every box off as a caricature of the corrupt, money laundering, South American organized crime leader. Still, the fact the movie was as fantastic as it was even with a middling villain proves how fantastic it truly was.",ThereelscoopwithKK,2023-02-28,2023
0,8.0,Still the best of the bunch!,"Yeah out of all the movies, this one still stands as my favorite! It basicly have everything you can ask for from a Fast and Furious movie!This movie Feels like the finale movie in the series, as it brings together our favorite characters from the previous movies, in the current timeline! It is over the top, but not as much as the later entries! The plot is also easy to understand, and not overly complex!This is an easy to enjoy action packed thrillride, with emotional, satisfying and intense moments! The last part of the movie is just bonkers and i LOVE it! The movie introduces ""The Rock"" as Luke Hobbs, whom is my favorite antagonistic force in this series!Overall this is just a solid action-movie!",and_mikkelsen,2023-03-18,2023
67,8.0,A Very Good Addition To The Franchise,"The fifth installment of this fun franchise.This time the action moves to Brazil, where we follow Dominic Toretto and the other characters as they try to rob a powerful criminal. Some new characters enter the story, such as Hobbs, played by Dwayne Johnson. His character is a fun addition to the franchise.The scenography is good, the soundtrack could be a little better, but it's not bad. The characters are over the top, but that's what's fun about this type of movie.A combination of action, humor and a fun story, this movie doesn't try to be something it's not, this is a movie that wants to entertain us.It is excellently directed, the car chase scenes are interesting, fun and look great. The film is filled with action scenes, car chases and gunfights.This movie is made to entertain the viewer and it certainly succeeds in that.",dk777,2023-03-24,2023
48,10.0,The Road To Fast X,"Fast Five is the Best Fast & Furious Movie and the most action packed installment in the series I love how it picks up after The Events of Fast & Furious
I mean come on this one has every thing you could want in a Fast & Furious movie action story heart soul and one of the best stuns ever
Of course we get introduced To Luke Hobbs who of course is the best villian that this series has seen I did like how this was call back to the Events of 2Fast 2Furious that at least was cool
Yes thie one has aged very well
A+
Every Friday we will be reviewing Every Fast & Furious movie leading up to Fast X
The Road To Fast X
The End Of The Road Begins.",jasonmichaeld,2023-03-31,2023
25,7.0,As A Whole Fast Five Was An Ok Fun And Entertaining Installment Despite Being The Weakest In The Franchise So Far,"It's hard to dislike Fast Five because the whole teams are back now, Han, Gal, and especially the likeable funny Tyrese who hasn't appeared since 2 Fast 2 Furious, those fun are unfortunately comes after the first weak and uninterested 40 minutes of the film, which wasn't garbage but i can absolutely skip it, Dwayne Johnson was a fine added, his fight with Vin Diesel was pretty exciting, the cop girl, Elena played just horribly by Elsa Pataky, the last action was a bit too long, and i also do think if it's not because of the team and it just another mission by Dom and Brian only it will not work, so Fast Five was definitely carried by the returning team, in terms of entertaiment i do mostly entertained, performances were also fine mostly, the rest of 90 minutes of the film was pretty good, as a whole Fast Five was an ok fun and entertaining installment despite being the weakest in the franchise so far.",HabibieHakim123,2023-04-13,2023
20,7.0,A Thrilling Heist that Ignites a New Era of the Franchise,"""Fast Five"" propels the ""Fast and Furious"" franchise to new heights with its electrifying blend of high-octane action, intense heists, and an ensemble cast firing on all cylinders. Picking up where the previous installment left off, the plot follows Dom Toretto (Vin Diesel), Brian O'Conner (Paul Walker), and their crew as they plan a daring heist in Rio de Janeiro while being pursued by a relentless federal agent (Dwayne Johnson).The film takes the franchise in a refreshing direction by incorporating the elements of a heist thriller. The meticulously planned and executed heist sequences are the heart of the film, showcasing the crew's impressive driving skills, precision teamwork, and audacious strategies. Each action set piece is expertly choreographed, filled with breathtaking stunts and jaw-dropping moments that will leave you on the edge of your seat.What sets ""Fast Five"" apart is the seamless integration of beloved characters from previous films. The chemistry between the cast members is palpable, with Vin Diesel and Paul Walker delivering standout performances that anchor the film. Dwayne Johnson's introduction as federal agent Luke Hobbs adds a new dynamic to the story, bringing his own brand of intensity and charisma to the table.The plot not only delivers adrenaline-pumping action but also delves into the characters' personal lives, exploring their motivations, loyalties, and the importance of family. It strikes a perfect balance between heart-pounding thrills and emotional resonance, making us invest in the characters and their journey.The film's breathtaking cinematography captures the vibrant streets of Rio de Janeiro, providing a visually stunning backdrop for the high-speed chases and explosive action. The pulsating soundtrack amplifies the excitement, perfectly complementing the adrenaline-fueled sequences.""Fast Five"" is a game-changer for the franchise, elevating it to new heights with its exhilarating heists, riveting performances, and a compelling blend of action and emotion. It sets the stage for the franchise's future, expanding its scope and introducing new possibilities. Whether you're a longtime fan or a newcomer, ""Fast Five"" is a must-watch for anyone seeking an adrenaline-fueled cinematic experience. Buckle up and get ready for an unforgettable ride.",sufyaanrashid95,2023-05-02,2023
27,6.0,Entertaining,"The transitional film in the franchise, featuring only one car race and giving more attention to action set pieces such as brawls, gun fights, and the central heist. Sprawling vehicular action and destruction. Familiar faces returning for a fun get-together.The script was a mess. But it doesn't matter because this franchise is all about delivering a jolly good entertainment nevertheless of the weak writing of Chris Morgan.The transitional film in the franchise, featuring only one car race and giving more attention to action set pieces such as brawls, gun fights, and the central heist. Sprawling vehicular action and destruction. Familiar faces returning for a fun get-together.The script was a mess. But it doesn't matter because this franchise is all about delivering a jolly good entertainment nevertheless of the weak writing of Chris Morgan.",ashfordofficial,2023-05-06,2023
22,7.0,Where everything changed,"As a teenager, I thought this was the best in the franchise and it makes sense considering how much action-packed it is and the whole ensemble coming together and their banter in it. But this time around for the first 40 minutes I was confused why this was the first critically acclaimed movie in the franchise because that 40 minutes was filled with stupid dialogues that is directed in the most cringey way possible with few thrills in there. But then they start assembling the crew and it became a proper heist movie and it started making sense why it is considered good. From that point on it kept entertaining throughout the movie.The Rock is way better here compared to most of his roles before this but looking back now, he wasn't as charming as his later lead roles for which he is more known for nowadays. The ensemble is really what worked the best film though. All of them together make this movie great to watch.This is where everything changed for the franchise and the scope of it really became huge but it still lacks the heart of the first movie and the tightness of Tokyo Drift. And it seemed like they wanted to connect Tokyo Drift through later movies from dialogues and I wonder how could they think that's a good idea, do they want us to think Japan in this movie's world is behind everywhere else to look like that after the events of these movies being so modern?",Jithindurden,2023-05-09,2023
23,7.0,Fast Five,"Picking up hot on the heels of the last film, the newly escaped ""Dom"" (Vin Diesel), his ex-FBI pal ""O'Conner"" (Paul Walker) and ""Mia"" (Jordan Brewster) have to keep skipping one step ahead of the pursuing law led by ""Hobbs"" (Dwayne Johnson) and, whilst cornered in Rio, they must assemble everyone with driving skills so as to thwart the ambitions of drug lord ""Reyes"" (Joaquim de Almeida) whom they have seriously hacked off. This effort sacrifices a little of the pace and speed of the other films and tries to focus on a slightly stronger story with some better characterisations - that does mean that it can be a bit on the slow side at times and maybe we get just one thoughtful pose from Diesel too many, but as we head towards a fairly predictable denouement this easily (for my money, anyway) tops the list of F&F films before clearly teeing us up for number 6. I think it's closer in quality and standard to the first film - and still has plenty of burnt rubber and lively stunts to keep it watchable.",CinemaSerf,2023-05-15,2023
47,4.0,Not that bad.,"It's a decent movie, one of the things wrong with it is that the action scenes are so unrealistic that it's almost as if you're watching a cartoon. They are constantly scenes where someone should have been permanently hospitalized or killed. And it seems like most of the movie is totally unrealistic action scenes. I'm left virtually always asking myself ""Come on, really?"" It's also very hard to keep track of who's working for who and who are the bad guys and who are the good guys. I wish it was somewhat better and had an actual plot so that I would be anxious to see the end the next movie. Other than those things, it's not a terrible movie.",dbarr123,2023-05-23,2023
76,10.0,A really large-scale film of the series,"The Fast and the Furious series approached its fifth iteration as a peculiar and diverse project. It seems that there have never been any problems with understanding the themes of the franchise throughout the series. Everyone understands that ""Fast and Furious"" is about cool cars, racing and an interesting story. However, the first four pictures are seriously different from each other, the films focus on different things. And the cast and setting varies from movie to movie. And, probably, it is the fifth ""Fast and Furious"" that sets new and now well-established rules by which the world of fast and furious exists to this day. Only the degree of unreality continues to increase. But this is already a topic for future reviews.The director of the film, Justin Lin, created a unique film that was head and shoulders above the previous pictures in the series, personally in my opinion. This is a really spectacular movie that still manages to border at the junction of the really acceptable and the fantastic.The script of the film was well worked out and did not leave the viewer indifferent. The intrigue of the film reaches its apotheosis by the final chase, which was really cool and exciting. Dragging two cars of a safe through the streets of the city for me personally today is something unimaginable and one of the most memorable excerpts from the entire series of films. The special effects in the movie are cool and realistic. Each scene is thought out to the smallest detail, which allowed us to create a unique atmosphere and breathtaking action scenes.Screenwriters Chris Morgan and Gary Scott Thompson worked out bright characters and an interesting plot that did not let the viewer get bored. The film starred many of the main actors of the franchise, including Vin Diesel, Paul Walker, Dwayne Johnson, Gal Gadot, Son Gun, Jordana Brewster, Tyrese Gibson, Chris Ludacris Bridges and many others. Each of them created a unique and interesting character, successfully contributed to the overall picture.Heroes know how to love and protect each other, work in a team and laugh, be selfless and collected, do everything in their power for the benefit of the whole team. So, without noticing it, the characters of the picture turn into a family. And the creators are doing an important thing. They show with this picture that the most important thing in life is family. And let this thought of Dominic Toretto acquire a lot of jokes later. The message is really correct. He is important, he teaches you to be able to be a brother, sister, friend, girlfriend. Watching the characters of the picture, the viewer may well learn to be the same selfless in real life, at least at a simple everyday level.The picture takes a new peak. The heroes are finally confronted by a truly worthy opponent, who was embodied on the screen by Dwayne Johnson. The actor played FBI agent Luke Hobbs, who did not leave the audience indifferent with his charisma and impressive physical form. Elsa Pataki was also good. Also a new face in the franchise. The girl plays the role of a policeman from the Hobbs squad. Her separate story also fits perfectly into the overall outline of the picture.The film ""Fast and Furious 5"" is not just a continuation of the series, another film, of which there are many. For me, this is a really strong movie that combines several genres at once. It is perfectly visible how the entire team of creators tried to surpass themselves and shoot a really cool project. In my opinion, it turned out great. Director Justin Lin has created a unique atmosphere that keeps the viewer in suspense throughout the film. And let it be an action movie, there will definitely be a place for drama in it, and the confrontation of the characters with each other will make you watch the development of events with interest.10 out of 10.",alekspredator87,2023-05-28,2023
21,7.0,Now this is more like it!,"Review: Definitley the turning point of the Fast Franchise for the better. Mainly because of the action Heist feel and the inclusion of The Rock!

Takeaways: -Though Racing is still a big part of the movie and the Fast series, the series starting with this movie, now takes more inspiration from Heist and spy movies such as Mission impossible, and Oceans Eleven. More focus is on pulling off heists against criminals.

-Dwayne Johnson, makes his debut as no-nonsense Recovery Agent Luke Hobbs, sent to arrest Dom and his friends after Dom escaped the prison transport at the end of the fourth movie. The Texas Lawman, Luke Hobbs is a heroic good guy character, and he is mainly doing his job when pursuing Dom and Brian. However they both eventually join forces to take out their common enemy, Drug lord Hernando Reyes. The Rock himself had played a huge part in the success of this film, and he also did the same in the 6th, 7th, and 8th films.

-So the story was that the moviemakers had originally envisioned Tommy Lee Jones to play Luke Hobbs, but Star/Producer Vin Diesel decided to get Dwayne Johnson cast after hearing from fans on how much they would love to see Vin brawl against ""The Rock""

-Elsa Pataky (Mrs Chris Hemsworth) also debuts as Officer Elena Neves who becomes Dom's new love interest. She helps Dom continue to cope with Letty's death.

-Roman Pierce and Tej Parker (and Eva Mende's Monica Fuentes in a cameo) also return for the first time since 2 Fast 2 Furious. They help form Dom's team to bust the bad guys. I love the Friendship that Roman and Tej form. It's funny how they make girl chasing as their competition lol

-Enter the Fast Avengers!

-Fast five I heard was originally intended to be the last one of the series, but because of this sequel's mega success, they decided to film more movies.

Conclusion: The franchise has been retooled and revamped as the movies now make sure that the action doesn't let up for a second!",myblueblazer,2023-05-30,2023
