,Rating,Title,Content,Author Name,Date,Year
9,10.0,my no1 film,This film made me. This has always been my favourite film probably because of the way they form the group it's iconic. The cast is just brilliant I can't imagine it was someone else and also the end seen my favourite thing. Danza Kuduro playing in the back chest it's amazing and I really feel like everyone should watch,miacoop,2021-01-11,2021
121,8.0,"If they failed on the 2nd, 3rd and 4th attempts, why not on the 5th attempt? And yes, they did it with praise !!","Of everything that involves this franchise (car racing / police investigation) and (besides the first film) that the sequences did not give a certain reason for existence that only made these films increasingly monotonous and uninteresting, ""Fast Five"" leaves aside what started this franchise with a more moving and frantic action movie, with characters even more fun to follow in their ""exploits"".",prietoheitor,2021-01-16,2021
44,10.0,Best action film,"Last week I saw Fast and Furious 5 / Fast five at the home. The main actors in this film are Paul Walker, Vin Diesel, and Dwayne Johnson... This film is an action thriller . This film is a story of two guys, Bryan who is an ex-policeman, and Dominic Torreto which is one of the best race drivers, and this hobby connects these two guys. These two guys have a plan how to steal 100 million dollars so they must do a really good team which will help them. But cop Hopps wants to catch them because Dominic and Bryan must be in prison for their actions. But in the end, he finds out they are not bad people and he helps them. The characters of Paul and Dominic are interesting because in the last films they weren't really good friends. But now they will be a true family and their adventures will be better . However, this film is really about friendship between all these characters. In my opinion, Fast and Furious films are one of the most popular in the world, so this film was fast-moving and gripping all the time. Special effects and stunts were so impresive. Like in all Fast and Furious films this has to some good music songs. I think is a ""tradition"" when these films have a good music.",imdb-58910,2021-02-07,2021
35,8.0,"Fast Five (2011, Justin Lin) The Fast franchise morphs into a large spectacular monster with this film","Fast Five (2011, Justin Lin) 'Fast Five' is named such because it is the 5th installment of the mega successful Fast & Furious franchise. If you take a look at billion dollar movies and take away comic book movies and James Cameron films about all that's left are Fast & Furious films along with some Disney/Pixar films which is impressive considering its rather humble roots, and you can easily point to this fifth installment where the series changed tactics and became something different, grander in scale and scope. The series always boated a wonderfully diverse cast, but this film gives the misfit street racer family an exotic locale to go with the super charged vehicles and it also assembles the core of what would be the team going forward. From the outset there was Vin Diesel's Dominic Toretto, Paul Walker's Brian O'Connor and Jordana Brewster's Mia Toretto. This cobbled together people who had appeared in other films including Ludacris, Tyrese Gibson and Sung Kang as fan favorite Han. Additionally they added the future Wonder Woman in Gal Gadot and Dwayne Johnson who collectively tripled the sex appeal of the film. To further ramp up the profile of the series instead of dealing with a simple street racer plot they started to vault into international intrigue on the scale of something that James Bond might handle. The crew inadvertently becomes their own version of an Impossible Mission Force. The show starts off with the crew on the run and Dom in prison. After a high profile escape featuring some pretty slick car work they wind up hiding in Rio de Janeiro which is a wonderful location for shooting due to the gritty yet colorful beauty of their urban sprawl capped by the ever watchful Christ the Redeemer statue and Sugarloaf. The crew not only runs afoul of the local drug kingpin, but also is being hunted by an elite CIA backed bounty squad headed by Johnson's Luke Hobbs. He starts as an attack dog, but by the climax he becomes an ally and would go on to be a legit team member in future installments. There are stories that behind the scenes Diesel and Johnson are often at odds for control over the series. While evading Hobbs the team goes to war against this drug lord that winds up being capped by a ridiculous but adrenaline charged chase scene that becomes an instant classic. It involves two Dodge Chargers pulling a bank vault through the streets of Rio using it as a weapon. This film is incredibly fun. It consistently reinforces the family theme which comes to be a hallmark for these films. There is not as much racing in this film as they skew away from that deliberately and turn toward more action based set pieces that happen to involve vehicles. As the installments move into the future those action set pieces get more and more eye popping and outlandish so back in 2011 the 'Fast Five' ones are relatively tame considering where they have gone. The direction is frenetic and gorgeous thanks to Justin Lin. The script is well written with good action, tension and humor. The action surely boils over into outlandish territory, but they embrace it so thoroughly that it only adds to the enjoyment of the overall endeavor. The wonderful location, amazing array of actors, slick script and elevated action plot really serve to make 'Fast Five' the pivotal film of this series and a paradigm shift that would serve to launch this film franchise into the stratosphere. Eric's Grade: B+",hoernkeem,2021-02-17,2021
97,2.0,OK the same story but a bit stretched,"Not liking the franchise so far, becoming very repetitive.",TheNonSmoker,2021-03-19,2021
19,7.0,Furious 5,"Vin diesel and paul walker are really good in this making this really entertaining and fun to watch.Insane stunts, chases, and fights. This starts the entertainingly craziness of this movie franchise.",MB-reviewer185,2021-04-24,2021
123,4.0,Not good,"It focuses on the characters way too much, and doesn't have enough high action car chases, that's what I want from a fast and furious movie.The plot line of Brian and Mia about to have a child is totally unnecessary, and it feels like a rushed production.",asherrbh_15,2021-05-06,2021
74,9.0,Very fast very cool,"Fast Five is a very cool movie. It is very different from the first parts. Excellence in watching very serious action and great photography. The debut of the great actor Dwayne Johnson, Justin Lynn, Wonderful Director. And I thank the crew. Although the film lacks a bit of clarification, it is still a great movie. I loved it and that is why I give it 9/10.",tamerhaddou-70008,2021-05-23,2021
42,5.0,Finally broke down and watched one of these things,"I never had any interest in the Fast and the Furious movies, which I'd never even heard of until it became the nickname for a political scandal. It sounded like something with a bunch of people racing cars and maybe committing or solving crimes or something. I don't care about speedy cars, I'm not into racing videogames, I'm definitely not the target audience.Recently I saw a trailer for a new one though, and I thought, this looks kind of fun. But since that movie got bad reviews I decided I would learn which was the best in the series and watch that.The movie was pretty much what I expected, cars and guns and muscly guys. It's stupid from the first brief action scene, which should have killed about 30 people but somehow doesn't. Then there's some unlikely plot, a bunch of driving and shooting, predictable twists, more shooting, a bunch of running.As action movies go, this seems vastly familiar to both the martial arts films of stars like Jet Li and Jackie Chan and the special effects driven superhero genre, and I don't get the appeal at all. But listen, it's not trying to entertain me, it's trying to entertain cars & muscly guys freaks, and if this sounds like something you'd like you'll probably like it.",cherold,2021-05-25,2021
5,7.0,Can We Get Any Faster!,"This was insane, what a watch that truly was, i have to admit they have been going totally off script when it comes to these movies considering this is a street racing movie basically turned into some James Bond type heist. I do like this addition though, never been a fan of The Rock and im still not but it was easy to ignore his scenes.Perfect cast, perfect Movie, can we go faster? Highly recommend!",BrnzReviews,2021-05-25,2021
63,8.0,"""Running ain't freedom. You should know that.""","Not saying this is my favorite because it takes place in Brazil, but it is my favorite one of the series for sure. You can tell that this is where the craziness started getting out of hand but at least in Fast Five they still balance it pretty well. My only minor gripe is that they didn't get actual Brazilians to be the bad guys and when they speak portuguese it is either bad or heavy ADR.",drewnes,2021-05-30,2021
110,10.0,Wow Great movie,Fast Five wow One of the best action movies with great stunts with cars This is the first time watching it this was insane I did not know it had this much stuff in this movie first I thought Prison Bus Break nope I was wrong still worked Dom does deliver in his performance amazing But Hob tho wow this movie just blows my mind Brian is the best in this movie I believe all the performances are great fast 4 walls missing some character elements I was hoping for first this was a prison bus break turns into them being on the run for breaking dom out than they go for the drug dealer that has 100 million dollars And the action is so good it is crazy what we can do nowadays it is nuts I do like we got out of the just racing in fast and furious I think the first 3 movies are meh than 4 I really like than 5 is the best one of my fav franchises for fun action and stunts with Great Characters So I give Fast Five An A+,projectsgamer,2021-05-31,2021
10,10.0,The best movie in this saga!,"Wow i love that movie. I watched a lot of times ,,Fast Five"" and it's the best in this saga.",hristokasabov,2021-06-10,2021
33,10.0,Fast Five has a great set of characters and is action packed from start to finish - My Ultimate Review,"Fast Five or Fast & Furious 5: Rio Heist as it's also known as, it's the third Fast & Furious film Justin Lin have directed and it's once again written by Chris Morgan. This installment gets the franchise to the action and roots that made me fall in love with the Fast films, gripping and suspenseful action sequences that make you sit at the edge of your seat. The focus on heists is the right move, they make it brilliant and entertaining, how a box office hit should be and succeeded. I won't lie the logic in these movies disappear more and more but they are entertaining. Having this movie take place in Brazil and Rio was an excellent choice. Also the cast and likeable characters are all memorable. Justin Lin's direction is one of the highlights in Fast Five, absolutely amazing. Chris Morgan's story and script is a huge step forward than the previous film, he did a great job. The dialogue was at times below average but I don't mind bad dialogue if the characters and actors execution is good and they are.Fast Five continues where the previous film left off. It follows Dominic Toretto, Brian O'Conner and their team as they plan a heist to steal $100 million from corrupt businessman Hernan Reyes while being pursued for arrest by U. S. Diplomatic Security Service agent Luke Hobbs. The ensemble cast has Vin Diesel, Paul Walker, Jordana Brewster, Tyrese Gibson, Chris ""Ludacris"" Bridges, Matt Schulze, Sung Kang, Tego Calderon and Gal Gadot. The new additions are Dwayne Johnson as Luke Hobbs, Joaquim de Almeida as Hernan Reyes and Elsa Pataky as Elena Neves. The new cast members are appreciated and so is the returning cast.On the technical side of things, they really outdid themselves. The quality have gone up on every aspect, sound editing and the whole production. The editing still amazes me, action sequences and non action ones. The pacing is fast and fits perfectly with the film. The cinematography have improved too, I still love the camera work and how they edit the car sequences, truly masterly done by them.What I truly love about this film is how they use practical effect and all the stunts, Paul Walker did all of his stunts and I'm sure Vin Diesel did too. The stunt involving the flatbed truck slamming into the moving train was filmed practically, if I remember correctly the last sequence involving the bank vault was also done practically or at least most of it. The action feels real and it's thanks to the stunt coordinator and stuntmen.What the Fast Saga does well is that it never slows down, movies about cars should only get faster and Fast and Furious will never slow down. After many viewings, I still love this film. Dare I even say that it's one of my favorite action films.",Holt344,2021-06-11,2021
7,10.0,Running Ain't Freedom,Fast Five is hands down The Best Fast & Furious Movie it's a lot of fun never takes it's foot off the gas the action is amazing I loved it I highly recommend the Extended Version.,jasonmichaeldickinson,2021-06-25,2021
51,10.0,Fast Five,"Amazing! This is the best Fast and Furious movie out of the first five. In a way, it was the culmination of the first 4 movies before it. Dom, Brian, and Mia are on the run in Brazil after breaking Dom out of a prison transport. They then decide to do a job with their old friend from the first movie, Vince because they need the money. The job goes wrong, and Dom, Brian, and Mia find out the one car they got away with has a chip that holds all of the info to where a billionaire holds his money. Dom, Brian, and Mia plan on stealing it, but they need a team. They recruit Roman, and Tej from 2 Fast 2 Furious, Han from Tokyo Drift, and Fast 4, and Gisele, Leo, and Santos from Fast 4. A lot more happens, they get Luke Hobbs, and Elena, two cops on their team because their team got murdered by the billionaire's men. Their job then got harder, but in pure Fast and Furious fashion, they end up pulling it off with an amazing chase through the streets of Rio with a safe attached to the back of their car destroying everything in sight. It is exactly what I expect from the Fast and Furious movies, and they did it better than ever in this one. Another thing I liked was how they decided to make the theme of this movie a heist. The first three all stayed with the street racing theme, the fourth changed a bit to drug smuggling/revenge, and this one was a heist.

This was the best movie in the series out of the first five and it isn't even close. I recommend this to anyone who wants to watch it even if they haven't seen the previous movies because this movie was action packed beyond belief.",kaden_lewis,2021-07-04,2021
107,8.0,Great mash up - cars and a heist,"You take the original team, add Dwayne Johnson and a heist, and you've got another great movie. Lots of action, cars+, but still the right amount of heart and familia. I give this film an 8 (great) out of 10. {Action} watch through to the end of the credits - a promising return.",nancyldraper,2021-07-10,2021
59,10.0,A Masterpiece,I fall in love with all this whenever I watch any movie in this series.,kamleshsharma-62519,2021-07-15,2021
60,8.0,Smarter and Better,"The Fast and the Furious films just keep getting better. Straying away from the street-racing scene was one of the smartest decisions the producers could have made. By focusing more on heists and espionage, this film breathed new life into a tired franchise. While some of the over-the-top action sequences were unrealistic and laughable, the film was still rooted on the core purpose of family and freedom.",jace_the_film_guy,2021-07-16,2021
52,9.0,Better than I expected,"Fast and Furious 5 is probably the best of all Fast. With it's elaborate and much more thoughtful action scene, you won't see the time go by. Despite the same cliché that comes up in each film, an unexpected ending would bring the film to an exceptional end! Although many shout that fast and furious has no story, my answer is that despite all the waiting and unlike the other furious, this one we can listen to with our brains.For teenagers and adults in need of strong sensations!",nourytourangeaualexandre,2021-07-22,2021
78,8.0,Best of the series so far,"I say so far because i havnt seen 6-9 yet but based on the series up to this point this is my favorite. Loved the characters, the story was awesome, good humor, it kept me intrested from beginning to end.",jeremyrhess,2021-08-01,2021
18,7.0,Fun,"Although it is exaggerated in terms of action, this series has always been funny and entertaining, and the 5th one is one of the more fun I have.",jack_o_hasanov_imdb,2021-08-07,2021
101,10.0,F & F 5,"Dominic, Letty, Brian & Mia, A crew that became FAMILY! Fast cars, beautiful girls and a safe... Remember the safe...",TharsheyN,2021-08-10,2021
108,8.0,As Good As It Gets!,"Saw this in cinemas back in 2011 & remember the film fairly well (its has been 10 years since I saw this last!) but re-call the ending well!

The film follows Dom & Brian on Heist Mission traveling from country to country while being pursued by Federal Agents & trying to avoid them!

I found the film to be pretty good! As with the previous films it's entertaining if not more as the 5th entry is when things really start to get bigger in terms of story, characters & of course, action!

The eye candy is great as always as with the creative action sequences which again this 5th film starts to mark after the 4th entry! I think each sequel seems to never disappoint & this is an example!

Overall, it's a great action flick to the F&F Franchise!",vengeance20,2021-08-12,2021
99,8.0,Keep em coming.,"Fast Five just keeps the saga moving, the acting is great with the rock finally tagging along and the end credit scene is just a mind blower. This movie sets the saga in motion and the movies keep getting better.",aingmire-26563,2021-08-17,2021
28,9.0,ADRENALINE OVERLOAD!!,"This is my favourite of the Fast and Furious films to date. After busting Dom from prison Brian and Mia go on the run and take on a job set up by Vince who hasnt been seen since the first film that goes sideways and are hunted down by not only by the Brazilian mob boss Reyes but Detective Hobbs. The guys turn the tables by plotting a mass heist of all Reyes money and we get intoduces to some new characters and some old ones from spin offs. The races and stunts, the characters and just the plain over the top nature of this film fills up a couple of hours wonderfully.",patches89,2021-08-19,2021
37,10.0,My Favourite Movie,"Amazing Car Chase, Stunts, Bank Safe & Lots of Street Racing, Action & Great Actors, Etc. Love it.My Favourite Movie, Enough Said. 10/10.",vipboss,2021-08-25,2021
6,10.0,My favorite!,"This is hands down my favorite Fast & Furious movie ever made. The plot is the best on my opinion, and the characters make it all the better!",AnnaPagrati,2021-08-28,2021
46,4.0,Terrible,If you want to waste your time with nonsense action scenes and terrible social messages this film is proper for you. Enjoy.,emremirza,2021-09-04,2021
111,8.0,A Much needed rejig for the franchise,"Fast Five aka Fast & Furious 5 or Fast & Furious 5: Rio Heist is a heist action film directed by Justin Lin and written by Chris Morgan. The film stars Vin Diesel, Late Paul Walker, Jordana Brewster, Tyrese Gibson, Chris ""Ludacris"" Bridges, Matt Schulze, Sung Kang, Tego Calderon, Don Omar, Gal Gadot, Dwayne Johnson, and Joaquim de Almeida.The film is the fifth installment in fast and furious series.This film is one of the best film of the series and with the introduction of Dwayne Johnson has gave the much needed boost to the series and also the credit should be given to makers by instilling new life in the series by introducing heist along with some car chases as the car racing were getting too monotonous. This step had not only increased the viewers base but also leased a new life in the franchise.The plot and the screenplay is flatly predictable but is still enjoyable, the funny scenes here and there will keep you entertained and the fast paced screenplay will keep you engaged.The stunts and action in the film is marvelous and few of the action scenes and stunts can be called as the major highlights of the film.Acting is good to decent and almost all the characters were honest and dedicated to their character, the only drawback which i felt was that the character of the antagonist in the film was not cooked properly or was under shadowed in the hoard of another actors. This role should've been developed more precisely and if they would have done the film could've been more grand, but sadly in this film the villain looked too week and isn't memorable.Climax of the film is also predictable as it's plot but is very entertaining and gives a satisfying pleasure. If you are a fan of fast and furious series or if you are a fan of heist series then this is the film for you. A much needed rejig for the franchise and eventually saved the franchise.",sauravjoshi85,2021-09-09,2021
64,10.0,one of the best furious movies ever made,"Here we have thrill, fun , nice girls, jokes and action scenes that are really good, and filmed in real world(the vault scenes and the train scenes are really great) so i can say, watch it and enjoy it, you know you will like this movie if u like action movies with real stunts and alot of jokes.",Cinema2kMendoza,2021-09-20,2021
4,5.0,The Fifth Time They Pull Their Last Job,"Vin Diesel is broken out of prison by the usual gang. With Dwayne Johnson in hot pursuit, they head off to Rio De Janeiro, where they steal some hot cars in the first practical effects showpiece. They turn out to belong to druglord Joaquim de Almeida; they discover he stored all his extensive papers detailing his evil empire and a hundred million dollars in cash in one of the cars, as one does, and decide to steal that for the second big practical effects showpiece as yet another last job they'll ever do.There are some fine performers here, but the cars are the real stars, and more work is done to make sure you can hear the engines than the dialogue. No one in the intended audience has ever heard of a muffler apparently. Still, the things they put these cars through is astonishing, if you like that sort of thing. Given that it has taken me ten years to see this hit movie, should give you an idea of how I feel about the matter.",boblipton,2021-10-16,2021
13,7.0,Movie moving into the new direction,"This is the first movie that turns the fast franchise into the movies we know today with how the crew acts. I like these movies because they're fun and who can't be happy with The rock, Paul and Vin just driven and kicking ass. I like the new direction they took with these movies up until number seven. After they lost Paul it did go down hill but they're still fun.",bosimmons-44782,2021-11-30,2021
16,7.0,On the Riun There,"Ex-cop and FBI agent turned fugitive Brian O'Connor and Mia Toretta the latter two a couple there as that they helped Dominici Mia's older brother out of prison. As now fugitives on the run.

And that Dwayne Johnson and his men that are in Brazil to bring the three to justice. While the three want to live on money that with the corrupt authorities there to steal.

In two cars that both Brian and Dom drive in safes to get them but they have to stay in Brazil in order to not return to the USA due to being wanted fugitives.",shelbythuylinh,2021-12-13,2021
119,10.0,Hamko Hamo,"Dom and Brian travel from one country to another, trying to throw the authorities off their scent. Now they have to bring their team together one more time while being chased by a federal agent.",hamkohamo,2021-12-14,2021
14,7.0,From racing into heist.,"The fifth installment puts several gallons of gas in the tank of this car-crazy franchise. Fast Five (also known as Fast and Furious 5 outside North America) is primed to equal if not better the $71 million opening weekend of its 2009 predecessor. Director Justin Lin, back for his third go-around, opens it up in top gear; a mere 30 seconds elapse before the first screech of tires rent the air. The film is set in a much grittier Rio than the recent screen version populated by animated birds. This is the most expensive installment yet and it's clear the budget wasn't used on acting lessons for the cast.Dwayne Johnson appears to be having fun with his overzealous staccato delivery. Walker and Brewster are as one-dimensional as ever, even while harboring a little secret that may see us lumbered with a future instalment titled Fast and Furious: The Next Generation.",Mysterygeneration,2021-12-21,2021
81,9.0,poky,"Enjoyment from these movies since they began, and I'd heard good things about this movie; how it had less CGI, how it was bigger, better and more intense as an action flick. Well, the good news is that it feels fresher in that it veers off in a slightly different direction in that it's.",abbadindiaguy,2021-12-28,2021
113,5.0,"Good action, bad story development","It is the fifth part of this saga and the same problems continue.The story is not good, it is full of conveniences and inconsistencies, although the special effects improve a lot and the action is good. Without much else to say, this movie is better than the last ones but the development of the story still doesn't convince me.",isaacochoterena,2022-01-06,2022
